image,text
../../datasets/OldStyles/style6/A man riding on the back of a red snow mobile.jpg,A man riding on the back of a red snow mobile
../../datasets/OldStyles/style6/A boardwalk area with crowds of people walking in both directions and kites flying overhead in the distance.jpg,A boardwalk area with crowds of people walking in both directions and kites flying overhead in the distance
../../datasets/OldStyles/style6/A baby lies on a bed looking wide-eyed at a computer.jpg,A baby lies on a bed looking wide-eyed at a computer
../../datasets/OldStyles/style6/Two guys on dirt bikes doing stunts in the air.jpg,Two guys on dirt bikes doing stunts in the air
../../datasets/OldStyles/style6/A boy is watching a pair of giraffe in an enclosed area.jpg,A boy is watching a pair of giraffe in an enclosed area
../../datasets/OldStyles/style6/a big sandwich next to some fries on a table.jpg,a big sandwich next to some fries on a table
../../datasets/OldStyles/style6/A tablet sitting in front of a typewriter with an lcd screen.jpg,A tablet sitting in front of a typewriter with an lcd screen
../../datasets/OldStyles/style6/A lavish toasted sandwich and potato chips at a restaurant.jpg,A lavish toasted sandwich and potato chips at a restaurant
../../datasets/OldStyles/style6/A man wearing a colorful umbrella hat holds an orange.jpg,A man wearing a colorful umbrella hat holds an orange
"../../datasets/OldStyles/style6/A white plate topped with red rice, broccoli and meat.jpg","A white plate topped with red rice, broccoli and meat"
../../datasets/OldStyles/style6/A train bed with a blue sheet and various items on it.jpg,A train bed with a blue sheet and various items on it
../../datasets/OldStyles/style6/A folding table sitting in a kitchen with a window behind the sink.jpg,A folding table sitting in a kitchen with a window behind the sink
../../datasets/OldStyles/style6/A white building is sitting atop a hill with a large clock.jpg,A white building is sitting atop a hill with a large clock
../../datasets/OldStyles/style6/A truck and aircraft next to some building in an airport.jpg,A truck and aircraft next to some building in an airport
../../datasets/OldStyles/style6/A dog and man with a hat sitting on a bench.jpg,A dog and man with a hat sitting on a bench
../../datasets/OldStyles/style6/Two kids playing a WII video game in the living room.jpg,Two kids playing a WII video game in the living room
../../datasets/OldStyles/style6/A colorful mural displayed in a small bathroom behind a toilet.jpg,A colorful mural displayed in a small bathroom behind a toilet
../../datasets/OldStyles/style6/a woman is playing with some dogs on some grass.jpg,a woman is playing with some dogs on some grass
../../datasets/OldStyles/style6/A man wearing a tie shakes hands with an older man while two other men look on.jpg,A man wearing a tie shakes hands with an older man while two other men look on
../../datasets/OldStyles/style6/A man is pulling a suit case with a little boy sitting on it.jpg,A man is pulling a suit case with a little boy sitting on it
../../datasets/OldStyles/style6/The interior of a kitchen with wood floors and large appliances.jpg,The interior of a kitchen with wood floors and large appliances
../../datasets/OldStyles/style6/A grey stripped cat on a table in a room with many books.jpg,A grey stripped cat on a table in a room with many books
../../datasets/OldStyles/style6/Five sticks with pastries and fruits arranged on them.jpg,Five sticks with pastries and fruits arranged on them
../../datasets/OldStyles/style6/Two people sitting beside each other at a table about to eat a pizza.jpg,Two people sitting beside each other at a table about to eat a pizza
../../datasets/OldStyles/style6/A tired poodle resting its head on a man's shoulder.jpg,A tired poodle resting its head on a man's shoulder
../../datasets/OldStyles/style6/Young man in a top hat with his arm around a young lady holding beers at a party.jpg,Young man in a top hat with his arm around a young lady holding beers at a party
../../datasets/OldStyles/style6/A large mirror is on the wall near a dresser with a television on it.jpg,A large mirror is on the wall near a dresser with a television on it
"../../datasets/OldStyles/style6/The living room has couches, a television, a table, and a blue ball.jpg","The living room has couches, a television, a table, and a blue ball"
../../datasets/OldStyles/style6/A man and a woman beside bicycles with orange train cars behind them.jpg,A man and a woman beside bicycles with orange train cars behind them
"../../datasets/OldStyles/style6/A person rides a bicycle down a busy, city road.jpg","A person rides a bicycle down a busy, city road"
../../datasets/OldStyles/style6/A girl is making a face while holding a wrench.jpg,A girl is making a face while holding a wrench
../../datasets/OldStyles/style6/Group of speed boats gathered at dock on water.jpg,Group of speed boats gathered at dock on water
../../datasets/OldStyles/style6/a single giraffe standing next some trees.jpg,a single giraffe standing next some trees
"../../datasets/OldStyles/style6/A kitchen with brown cabinets, tile backsplash, and grey counters.jpg","A kitchen with brown cabinets, tile backsplash, and grey counters"
../../datasets/OldStyles/style6/Two zebras standing in an enclosure surrounded by trees.jpg,Two zebras standing in an enclosure surrounded by trees
../../datasets/OldStyles/style6/a red and white stop sign and a white fence.jpg,a red and white stop sign and a white fence
../../datasets/OldStyles/style6/a red building that has a umbrella outside of it.jpg,a red building that has a umbrella outside of it
../../datasets/OldStyles/style6/Three people riding on the back of an elephant.jpg,Three people riding on the back of an elephant
../../datasets/OldStyles/style6/Mushrooms atop a slice of ham on a marinara-covered pastry.jpg,Mushrooms atop a slice of ham on a marinara-covered pastry
../../datasets/OldStyles/style6/a tennis player hitting a serve on the court.jpg,a tennis player hitting a serve on the court
../../datasets/OldStyles/style6/A man standing next to a parked motorcycle.jpg,A man standing next to a parked motorcycle
../../datasets/OldStyles/style6/A small potted plant sits on the floor.jpg,A small potted plant sits on the floor
../../datasets/OldStyles/style6/A single elephant alone in a natural habitat.jpg,A single elephant alone in a natural habitat
../../datasets/OldStyles/style6/There is a umbrella by the bench near the water.jpg,There is a umbrella by the bench near the water
../../datasets/OldStyles/style6/A kitchen with wooden cabinets has a table counter in the middle with miscellaneous ingredients.jpg,A kitchen with wooden cabinets has a table counter in the middle with miscellaneous ingredients
../../datasets/OldStyles/style6/A little child stands near a colorful kit in a grassy area near some buildings.jpg,A little child stands near a colorful kit in a grassy area near some buildings
"../../datasets/OldStyles/style6/A pointy looking, black jet of some sort sits on the runway.jpg","A pointy looking, black jet of some sort sits on the runway"
../../datasets/OldStyles/style6/a group of people pose for a picture at a wedding.jpg,a group of people pose for a picture at a wedding
../../datasets/OldStyles/style6/a building with a sign attached to it.jpg,a building with a sign attached to it
../../datasets/OldStyles/style6/A large sandwich is on a plate next to a plate with a wrap.jpg,A large sandwich is on a plate next to a plate with a wrap
../../datasets/OldStyles/style6/A train carrying a long line of freight cars with tractors.jpg,A train carrying a long line of freight cars with tractors
"../../datasets/OldStyles/style6/Street view of a home, electrical posts and a street sign.jpg","Street view of a home, electrical posts and a street sign"
../../datasets/OldStyles/style6/The man is in a suit and tie talking to the woman.jpg,The man is in a suit and tie talking to the woman
../../datasets/OldStyles/style6/a male skateboarder in a white shirt  and a dog.jpg,a male skateboarder in a white shirt  and a dog
../../datasets/OldStyles/style6/three giraffes in the grass touching each other.jpg,three giraffes in the grass touching each other
../../datasets/OldStyles/style6/A man squats on the ground holding his surf board across his legs.jpg,A man squats on the ground holding his surf board across his legs
"../../datasets/OldStyles/style6/A living area with couches, a sofa and a fireplace.jpg","A living area with couches, a sofa and a fireplace"
../../datasets/OldStyles/style6/three piece stone bench in the middle of a park.jpg,three piece stone bench in the middle of a park
../../datasets/OldStyles/style6/A shirtless man on the beach drinking a beer.jpg,A shirtless man on the beach drinking a beer
../../datasets/OldStyles/style6/A skier is weaving through the copious amount of snow.jpg,A skier is weaving through the copious amount of snow
../../datasets/OldStyles/style6/The colorful hat has two stuffed animals on it.jpg,The colorful hat has two stuffed animals on it
"../../datasets/OldStyles/style6/Laced shoes on stairs, with dog climbing one down.jpg","Laced shoes on stairs, with dog climbing one down"
../../datasets/OldStyles/style6/a train that is parked on a rail road track.jpg,a train that is parked on a rail road track
../../datasets/OldStyles/style6/A baby zebra with its mother in black and white.jpg,A baby zebra with its mother in black and white
../../datasets/OldStyles/style6/A woman smiles brightly as three birds are standing on her arm.jpg,A woman smiles brightly as three birds are standing on her arm
../../datasets/OldStyles/style6/Traffic intersection with street signs surrounded by cars and trucks.jpg,Traffic intersection with street signs surrounded by cars and trucks
../../datasets/OldStyles/style6/An open desk top with many windows up in a park.jpg,An open desk top with many windows up in a park
"../../datasets/OldStyles/style6/A group of teddy bears of various colors, some with clothes, some not.jpg","A group of teddy bears of various colors, some with clothes, some not"
../../datasets/OldStyles/style6/A bus and truck on a parking bay.jpg,A bus and truck on a parking bay
../../datasets/OldStyles/style6/trains on a track near a train station platform.jpg,trains on a track near a train station platform
../../datasets/OldStyles/style6/A tennis player hold a racket and a ball.jpg,A tennis player hold a racket and a ball
"../../datasets/OldStyles/style6/A counter with a bottle of whine, carrots with cheese and bread on a platter.jpg","A counter with a bottle of whine, carrots with cheese and bread on a platter"
../../datasets/OldStyles/style6/A shirtless man doing tricks on his skateboard.jpg,A shirtless man doing tricks on his skateboard
../../datasets/OldStyles/style6/A group of boats that are resting on the beach.jpg,A group of boats that are resting on the beach
../../datasets/OldStyles/style6/A trio of giraffes lounging in a fenced off grass area.jpg,A trio of giraffes lounging in a fenced off grass area
../../datasets/OldStyles/style6/A view from a distance looking at a public clock.jpg,A view from a distance looking at a public clock
"../../datasets/OldStyles/style6/A batter, catcher and umpire are awaiting the next pitch.jpg","A batter, catcher and umpire are awaiting the next pitch"
../../datasets/OldStyles/style6/A street sign lite up next to parked cars.jpg,A street sign lite up next to parked cars
../../datasets/OldStyles/style6/Some tiny cookies are in a large glass vase.jpg,Some tiny cookies are in a large glass vase
../../datasets/OldStyles/style6/a kid seated at the edge of the bench.jpg,a kid seated at the edge of the bench
"../../datasets/OldStyles/style6/A plate of food with a sandwich, bowl, and spoon.jpg","A plate of food with a sandwich, bowl, and spoon"
../../datasets/OldStyles/style6/A man being pulled by a horse in the snow.jpg,A man being pulled by a horse in the snow
../../datasets/OldStyles/style6/a white and black picture with a fire hydrant on the end of the street.jpg,a white and black picture with a fire hydrant on the end of the street
../../datasets/OldStyles/style6/Taxicabs and other vehicles move through a city's intersections.jpg,Taxicabs and other vehicles move through a city's intersections
../../datasets/OldStyles/style6/A group of zebra's leaned over drinking water.jpg,A group of zebra's leaned over drinking water
../../datasets/OldStyles/style6/A woman dressed up sitting in the woods.jpg,A woman dressed up sitting in the woods
../../datasets/OldStyles/style6/Small child being held up on skis by a woman.jpg,Small child being held up on skis by a woman
../../datasets/OldStyles/style6/Three people playing a game with black controllers.jpg,Three people playing a game with black controllers
../../datasets/OldStyles/style6/A city bus turns into a side street in the rain.jpg,A city bus turns into a side street in the rain
../../datasets/OldStyles/style6/Boys are laying in their bunk beds with a ladder.jpg,Boys are laying in their bunk beds with a ladder
../../datasets/OldStyles/style6/Two men sitting on a couch working on their laptops.jpg,Two men sitting on a couch working on their laptops
../../datasets/OldStyles/style6/A boy is riding a small beginner snowboard.jpg,A boy is riding a small beginner snowboard
../../datasets/OldStyles/style6/A partially renovated kitchen in a family home.jpg,A partially renovated kitchen in a family home
../../datasets/OldStyles/style6/Baseball player standing in the batters box ready to hit.jpg,Baseball player standing in the batters box ready to hit
../../datasets/OldStyles/style6/A street corner has some parked cars and a fire hydrant.jpg,A street corner has some parked cars and a fire hydrant
../../datasets/OldStyles/style6/A kid interacts with an adult tennis player.jpg,A kid interacts with an adult tennis player
../../datasets/OldStyles/style6/A young man is sitting near a half empty tray of pizza.jpg,A young man is sitting near a half empty tray of pizza
../../datasets/OldStyles/style6/There is a plane being loaded on the tarmac.jpg,There is a plane being loaded on the tarmac
../../datasets/OldStyles/style6/A plate filled with dessert sitting next to a plate filled with food.jpg,A plate filled with dessert sitting next to a plate filled with food
../../datasets/OldStyles/style6/A decorative ornate urn depicting people and swine.jpg,A decorative ornate urn depicting people and swine
../../datasets/OldStyles/style6/A large knife and a pizza on a table.jpg,A large knife and a pizza on a table
../../datasets/OldStyles/style6/A man riding a skate board in front of a store front.jpg,A man riding a skate board in front of a store front
../../datasets/OldStyles/style6/A snowboarder in the middle of a jump.jpg,A snowboarder in the middle of a jump
../../datasets/OldStyles/style6/A white cow walks towards the camera on a small path through a green forest.jpg,A white cow walks towards the camera on a small path through a green forest
../../datasets/OldStyles/style6/A horse is standing behind behind a fence.jpg,A horse is standing behind behind a fence
../../datasets/OldStyles/style6/A small bird resting on a rock close to water.jpg,A small bird resting on a rock close to water
../../datasets/OldStyles/style6/A yellow and orange passenger bus at night.jpg,A yellow and orange passenger bus at night
../../datasets/OldStyles/style6/A bus driving down the street near a traffic light.jpg,A bus driving down the street near a traffic light
../../datasets/OldStyles/style6/Taxicabs and other vehicles move through city's intersections.jpg,Taxicabs and other vehicles move through city's intersections
../../datasets/OldStyles/style6/The boy is standing very close to the beer inside of his habitat.jpg,The boy is standing very close to the beer inside of his habitat
../../datasets/OldStyles/style6/Two donuts are on a tray with water and honey.jpg,Two donuts are on a tray with water and honey
../../datasets/OldStyles/style6/A bicycle covered in christmas decorations parked next to a van.jpg,A bicycle covered in christmas decorations parked next to a van
../../datasets/OldStyles/style6/woman with racquet standing in middle of tennis court.jpg,woman with racquet standing in middle of tennis court
../../datasets/OldStyles/style6/Someone laying on a wood floor with a dog.jpg,Someone laying on a wood floor with a dog
../../datasets/OldStyles/style6/A man flying through the air while riding a snowboard.jpg,A man flying through the air while riding a snowboard
../../datasets/OldStyles/style6/An orange dog and a white dog laying on a bed.jpg,An orange dog and a white dog laying on a bed
../../datasets/OldStyles/style6/The white airplane is sitting at the terminal.jpg,The white airplane is sitting at the terminal
../../datasets/OldStyles/style6/A little girl posing for a photo with a dog.jpg,A little girl posing for a photo with a dog
../../datasets/OldStyles/style6/A guy skateboarding down the street with a dog.jpg,A guy skateboarding down the street with a dog
../../datasets/OldStyles/style6/A person cutting up food that is on a plate.jpg,A person cutting up food that is on a plate
../../datasets/OldStyles/style6/A man riding a kiteboard over a body of water.jpg,A man riding a kiteboard over a body of water
../../datasets/OldStyles/style6/A man takes a swings at a tennis ball on a court.jpg,A man takes a swings at a tennis ball on a court
../../datasets/OldStyles/style6/A school bus parked with it's stop sign closed.jpg,A school bus parked with it's stop sign closed
../../datasets/OldStyles/style6/a figure of a horse is on a red chair.jpg,a figure of a horse is on a red chair
../../datasets/OldStyles/style6/A horse is pulling a small white carriage.jpg,A horse is pulling a small white carriage
../../datasets/OldStyles/style6/Various toys and items on carpet that includes wallets and a camera.jpg,Various toys and items on carpet that includes wallets and a camera
../../datasets/OldStyles/style6/The vanity has two sinks and two mirrors.jpg,The vanity has two sinks and two mirrors
../../datasets/OldStyles/style6/A toilet with toilet paper rolls on the ground.jpg,A toilet with toilet paper rolls on the ground
../../datasets/OldStyles/style6/A man throwing a frisbee in the rocks by a river.jpg,A man throwing a frisbee in the rocks by a river
../../datasets/OldStyles/style6/A red fire hydrant that is half covered in snow.jpg,A red fire hydrant that is half covered in snow
../../datasets/OldStyles/style6/Grandfather clock on fireplace mantel near chair and narrow window.jpg,Grandfather clock on fireplace mantel near chair and narrow window
../../datasets/OldStyles/style6/A red apple with a knife stuck into it.jpg,A red apple with a knife stuck into it
../../datasets/OldStyles/style6/A close up of an orange sitting on something.jpg,A close up of an orange sitting on something
../../datasets/OldStyles/style6/Hanging bunches of ripe bananas and boxes of various fruit.jpg,Hanging bunches of ripe bananas and boxes of various fruit
../../datasets/OldStyles/style6/A rider in a  t-shirt riding a surfboard.jpg,A rider in a  t-shirt riding a surfboard
../../datasets/OldStyles/style6/A street scene in a dense urban area.jpg,A street scene in a dense urban area
../../datasets/OldStyles/style6/a kid sitting next to a fire hydrant for a picture.jpg,a kid sitting next to a fire hydrant for a picture
../../datasets/OldStyles/style6/A SKIER SKIING ON THE MOUNTAIN WITH TREES BEHIND HIM.jpg,A SKIER SKIING ON THE MOUNTAIN WITH TREES BEHIND HIM
../../datasets/OldStyles/style6/Two elephants head to head in an enclosure.jpg,Two elephants head to head in an enclosure
../../datasets/OldStyles/style6/A airplane that is sitting on a tarmac.jpg,A airplane that is sitting on a tarmac
../../datasets/OldStyles/style6/a little dog staring at a woman in the kitchen.jpg,a little dog staring at a woman in the kitchen
../../datasets/OldStyles/style6/A sitting area set up in the shade of thick brush.jpg,A sitting area set up in the shade of thick brush
../../datasets/OldStyles/style6/A white spa-like bathroom with towels and flowers.jpg,A white spa-like bathroom with towels and flowers
../../datasets/OldStyles/style6/A brick building has an antique clock with Roman numerals.jpg,A brick building has an antique clock with Roman numerals
../../datasets/OldStyles/style6/The people are playing the game in the living room.jpg,The people are playing the game in the living room
../../datasets/OldStyles/style6/The young man is practicing his tricks on his skateboard.jpg,The young man is practicing his tricks on his skateboard
../../datasets/OldStyles/style6/A bowl of cereal next to a bunch of oranges.jpg,A bowl of cereal next to a bunch of oranges
../../datasets/OldStyles/style6/a close up of a goose with a water background.jpg,a close up of a goose with a water background
../../datasets/OldStyles/style6/A woman has two cupcakes on her plate.jpg,A woman has two cupcakes on her plate
../../datasets/OldStyles/style6/A cat chewing on the end of a brush.jpg,A cat chewing on the end of a brush
../../datasets/OldStyles/style6/Sandwich on a white plate with mixed greens.jpg,Sandwich on a white plate with mixed greens
../../datasets/OldStyles/style6/The cake is for a girl who is turning nine years old.jpg,The cake is for a girl who is turning nine years old
../../datasets/OldStyles/style6/A man holding onto a street sign while he wears  a yellow shirt.jpg,A man holding onto a street sign while he wears  a yellow shirt
../../datasets/OldStyles/style6/A white plate topped with a bowl of food and a bowl of fruit.jpg,A white plate topped with a bowl of food and a bowl of fruit
../../datasets/OldStyles/style6/A yellow boat is sitting up on a beach.jpg,A yellow boat is sitting up on a beach
../../datasets/OldStyles/style6/Players shake hands over the net at a tennis match.jpg,Players shake hands over the net at a tennis match
../../datasets/OldStyles/style6/There are four mice set up in front of a computer.jpg,There are four mice set up in front of a computer
../../datasets/OldStyles/style6/The man is skiing in the white cold snow.jpg,The man is skiing in the white cold snow
../../datasets/OldStyles/style6/Four zebras crossing a highway with vehicles waiting.jpg,Four zebras crossing a highway with vehicles waiting
../../datasets/OldStyles/style6/A tennis player is holding the racket tight.jpg,A tennis player is holding the racket tight
../../datasets/OldStyles/style6/A man sitting on a motorcycle by a fence.jpg,A man sitting on a motorcycle by a fence
../../datasets/OldStyles/style6/A man plays frisbee in a small field.jpg,A man plays frisbee in a small field
../../datasets/OldStyles/style6/A living room connected to a dining room with wood flooring.jpg,A living room connected to a dining room with wood flooring
../../datasets/OldStyles/style6/A horse grazing on a countryside near a ranch house.jpg,A horse grazing on a countryside near a ranch house
../../datasets/OldStyles/style6/A series of photographs shoring different cakes and things being baked.jpg,A series of photographs shoring different cakes and things being baked
../../datasets/OldStyles/style6/an airplane is soaring through a sky of clouds.jpg,an airplane is soaring through a sky of clouds
../../datasets/OldStyles/style6/A small bird perched on top of a tree branch.jpg,A small bird perched on top of a tree branch
../../datasets/OldStyles/style6/A bus in front of a business and parking lot.jpg,A bus in front of a business and parking lot
../../datasets/OldStyles/style6/A pipe has red caps and yellow tags.jpg,A pipe has red caps and yellow tags
../../datasets/OldStyles/style6/there is a small white bird standing on top of the elephants head.jpg,there is a small white bird standing on top of the elephants head
../../datasets/OldStyles/style6/A clock tower seen behind bare tree branches.jpg,A clock tower seen behind bare tree branches
../../datasets/OldStyles/style6/a man in japanese armor talking on a cell phone.jpg,a man in japanese armor talking on a cell phone
../../datasets/OldStyles/style6/A ski racer goes down a snowy hill.jpg,A ski racer goes down a snowy hill
../../datasets/OldStyles/style6/A photo take though glass of a polar pear diving under water.jpg,A photo take though glass of a polar pear diving under water
../../datasets/OldStyles/style6/There are several kites being flown in a field near the water.jpg,There are several kites being flown in a field near the water
../../datasets/OldStyles/style6/A bag with a computer and quilt sits on a table.jpg,A bag with a computer and quilt sits on a table
../../datasets/OldStyles/style6/A girl ready to cut cakes at a table next to a man.jpg,A girl ready to cut cakes at a table next to a man
../../datasets/OldStyles/style6/Fish eye picture of room from security camera.jpg,Fish eye picture of room from security camera
../../datasets/OldStyles/style6/A cow behind a gate in a building.jpg,A cow behind a gate in a building
../../datasets/OldStyles/style6/There is a giraffe sticking its tongue out at children.jpg,There is a giraffe sticking its tongue out at children
../../datasets/OldStyles/style6/The cat is laying next to a pair of boots.jpg,The cat is laying next to a pair of boots
../../datasets/OldStyles/style6/A paper plate topped with a sandwich filed with lettuce.jpg,A paper plate topped with a sandwich filed with lettuce
../../datasets/OldStyles/style6/A black cat sitting on a white toilet seat.jpg,A black cat sitting on a white toilet seat
../../datasets/OldStyles/style6/A bus that is sitting in the street.jpg,A bus that is sitting in the street
../../datasets/OldStyles/style6/A sign on a metal pole on a street.jpg,A sign on a metal pole on a street
