image,text
../../datasets/OldStyles/style6/An old photo of a line of people riding horses or donkeys pulling carts down the town street.jpg,An old photo of a line of people riding horses or donkeys pulling carts down the town street
../../datasets/OldStyles/style6/Man in a white outfit on a tennis court holding a racket.jpg,Man in a white outfit on a tennis court holding a racket
../../datasets/OldStyles/style6/a close up of a person wearing a suit and tie.jpg,a close up of a person wearing a suit and tie
../../datasets/OldStyles/style6/A lamb looking at bars in a cage with grass.jpg,A lamb looking at bars in a cage with grass
../../datasets/OldStyles/style6/A black and grey cat laying on a plugged in hard drive.jpg,A black and grey cat laying on a plugged in hard drive
../../datasets/OldStyles/style6/A green and white van full of signs written in spanish.jpg,A green and white van full of signs written in spanish
../../datasets/OldStyles/style6/a girl is holding a red umbrella above her.jpg,a girl is holding a red umbrella above her
../../datasets/OldStyles/style6/A zebra walks across a field with other animals in the background.jpg,A zebra walks across a field with other animals in the background
../../datasets/OldStyles/style6/A group of boys on a staircase holding a blue flag.jpg,A group of boys on a staircase holding a blue flag
../../datasets/OldStyles/style6/an image of a dog wearing a scarf on his neck.jpg,an image of a dog wearing a scarf on his neck
../../datasets/OldStyles/style6/A large building has a white clock at the center.jpg,A large building has a white clock at the center
../../datasets/OldStyles/style6/A red train car on display at a museum.jpg,A red train car on display at a museum
../../datasets/OldStyles/style6/A picture of a red and white train in the snow on the tracks.jpg,A picture of a red and white train in the snow on the tracks
../../datasets/OldStyles/style6/A man swings his bat as he runs while a hand reaches to catch the ball behind him.jpg,A man swings his bat as he runs while a hand reaches to catch the ball behind him
../../datasets/OldStyles/style6/A long colorful train traveling down train tracks.jpg,A long colorful train traveling down train tracks
../../datasets/OldStyles/style6/A bear sitting a desk with a computer.jpg,A bear sitting a desk with a computer
../../datasets/OldStyles/style6/A fire hose wound up and sitting in a bin against a wall.jpg,A fire hose wound up and sitting in a bin against a wall
../../datasets/OldStyles/style6/Two women smiling for a picture while on the ski slope.jpg,Two women smiling for a picture while on the ski slope
../../datasets/OldStyles/style6/Three large birds sits atop a wooden railing.jpg,Three large birds sits atop a wooden railing
../../datasets/OldStyles/style6/A man standing next to a woman in a kitchen preparing food.jpg,A man standing next to a woman in a kitchen preparing food
../../datasets/OldStyles/style6/a small pizza is sitting on a table.jpg,a small pizza is sitting on a table
../../datasets/OldStyles/style6/A giraffe uses it's long neck to search for food.jpg,A giraffe uses it's long neck to search for food
../../datasets/OldStyles/style6/Several men in clean baseball uniforms are talking.jpg,Several men in clean baseball uniforms are talking
../../datasets/OldStyles/style6/A white surfboard in the back of a truck covered in sand.jpg,A white surfboard in the back of a truck covered in sand
../../datasets/OldStyles/style6/a person that is skateboarding down a rail.jpg,a person that is skateboarding down a rail
../../datasets/OldStyles/style6/A man on a surfboard being pulled into the air by a sail.jpg,A man on a surfboard being pulled into the air by a sail
../../datasets/OldStyles/style6/A person sitting on a bench under a overpass.jpg,A person sitting on a bench under a overpass
"../../datasets/OldStyles/style6/A toilet, sink, shower and mirror in a bathroom.jpg","A toilet, sink, shower and mirror in a bathroom"
../../datasets/OldStyles/style6/A black cat wearing a bright red license tag.jpg,A black cat wearing a bright red license tag
../../datasets/OldStyles/style6/A wooden bench next to flowering bushes and plants.jpg,A wooden bench next to flowering bushes and plants
../../datasets/OldStyles/style6/A giraffe is walking alone through the field.jpg,A giraffe is walking alone through the field
../../datasets/OldStyles/style6/A girl looks up at a guy in a backwards hat.jpg,A girl looks up at a guy in a backwards hat
../../datasets/OldStyles/style6/Man skateboarding with protective gear and orange cones.jpg,Man skateboarding with protective gear and orange cones
../../datasets/OldStyles/style6/A table with a cate fashioned to look like a desk and laptop.jpg,A table with a cate fashioned to look like a desk and laptop
../../datasets/OldStyles/style6/five professional motorcyclist racing on a race track.jpg,five professional motorcyclist racing on a race track
../../datasets/OldStyles/style6/some brown black and white horse in their pen eating grass.jpg,some brown black and white horse in their pen eating grass
../../datasets/OldStyles/style6/A number of children and adults gathered near a mini train ride.jpg,A number of children and adults gathered near a mini train ride
../../datasets/OldStyles/style6/A bus driving down a street next to a  tall building.jpg,A bus driving down a street next to a  tall building
../../datasets/OldStyles/style6/A man puts his hand above a grill covered with hot dogs.jpg,A man puts his hand above a grill covered with hot dogs
../../datasets/OldStyles/style6/An older lady and a young girl sitting at a table at the park.jpg,An older lady and a young girl sitting at a table at the park
../../datasets/OldStyles/style6/A bathroom mirror shows a person taking a picture of a large bathroom.jpg,A bathroom mirror shows a person taking a picture of a large bathroom
../../datasets/OldStyles/style6/Four dogs trying to eat out of the same bow of food.jpg,Four dogs trying to eat out of the same bow of food
"../../datasets/OldStyles/style6/Three surfers at bottom a wave, two looking for their boards.jpg","Three surfers at bottom a wave, two looking for their boards"
../../datasets/OldStyles/style6/three giraffes standing near a skinny tree at the zoo.jpg,three giraffes standing near a skinny tree at the zoo
../../datasets/OldStyles/style6/A man decorated with souvenirs surfing in the ocean.jpg,A man decorated with souvenirs surfing in the ocean
../../datasets/OldStyles/style6/A baseball player holding a bat near home plate.jpg,A baseball player holding a bat near home plate
../../datasets/OldStyles/style6/A clock on a pole in front of a building.jpg,A clock on a pole in front of a building
../../datasets/OldStyles/style6/Black cow standing on a hill with grass on it.jpg,Black cow standing on a hill with grass on it
../../datasets/OldStyles/style6/A woman in burlesque clothing holding an umbrella.jpg,A woman in burlesque clothing holding an umbrella
../../datasets/OldStyles/style6/A couple of horses standing in a grass field.jpg,A couple of horses standing in a grass field
../../datasets/OldStyles/style6/a bed that has some animals on it.jpg,a bed that has some animals on it
../../datasets/OldStyles/style6/a yellow fire hydrant some leaves bushes and trees.jpg,a yellow fire hydrant some leaves bushes and trees
../../datasets/OldStyles/style6/A white car with a clock on its roof on street.jpg,A white car with a clock on its roof on street
"../../datasets/OldStyles/style6/A man skiing down a hill in the open, with his arms out.jpg","A man skiing down a hill in the open, with his arms out"
../../datasets/OldStyles/style6/Oversized pillows and a decorative pillow top a bed adorned a large wooden headboard.jpg,Oversized pillows and a decorative pillow top a bed adorned a large wooden headboard
../../datasets/OldStyles/style6/A giraffe stands in  a zoo enclosure next to a building.jpg,A giraffe stands in  a zoo enclosure next to a building
../../datasets/OldStyles/style6/shelves on a wall full of teddy bears.jpg,shelves on a wall full of teddy bears
"../../datasets/OldStyles/style6/This is home plate during a pro baseball game at the moment that umpire, catcher and batter are focused  on the incoming pitch.jpg","This is home plate during a pro baseball game at the moment that umpire, catcher and batter are focused  on the incoming pitch"
../../datasets/OldStyles/style6/a store sitting on a dock near the water.jpg,a store sitting on a dock near the water
../../datasets/OldStyles/style6/A semi wooded park setting with benches for sitting.jpg,A semi wooded park setting with benches for sitting
../../datasets/OldStyles/style6/A stuffed bear sitting in a truck with a Yankee Candle logo.jpg,A stuffed bear sitting in a truck with a Yankee Candle logo
../../datasets/OldStyles/style6/A street filled with metal street signs and store signs.jpg,A street filled with metal street signs and store signs
../../datasets/OldStyles/style6/this is a man riding a bike at a skate park.jpg,this is a man riding a bike at a skate park
../../datasets/OldStyles/style6/The two slices of pizza each have different shapes and toppings.jpg,The two slices of pizza each have different shapes and toppings
../../datasets/OldStyles/style6/Fruits and vegetables are displayed on a kitchen countertop.jpg,Fruits and vegetables are displayed on a kitchen countertop
../../datasets/OldStyles/style6/A living room filled with furniture and a large window.jpg,A living room filled with furniture and a large window
../../datasets/OldStyles/style6/A man doing tricks on a skateboard on the street.jpg,A man doing tricks on a skateboard on the street
../../datasets/OldStyles/style6/a couple of vases are sitting by a curb.jpg,a couple of vases are sitting by a curb
../../datasets/OldStyles/style6/A cat sitting on to of a bathroom sink next to a mirror.jpg,A cat sitting on to of a bathroom sink next to a mirror
../../datasets/OldStyles/style6/A tennis player throwing a ball up to hit it.jpg,A tennis player throwing a ball up to hit it
../../datasets/OldStyles/style6/a tagged train going slowly down the track.jpg,a tagged train going slowly down the track
../../datasets/OldStyles/style6/A woman gives a thumbs-up signal while taking a slice of pizza.jpg,A woman gives a thumbs-up signal while taking a slice of pizza
../../datasets/OldStyles/style6/a blurred photo of a bat hissing at something.jpg,a blurred photo of a bat hissing at something
../../datasets/OldStyles/style6/A red fire hydrant and a sign next to tree.jpg,A red fire hydrant and a sign next to tree
"../../datasets/OldStyles/style6/A glass bowl with bananas, oranges, and pears.jpg","A glass bowl with bananas, oranges, and pears"
../../datasets/OldStyles/style6/A person holds their hat and rides a horse.jpg,A person holds their hat and rides a horse
../../datasets/OldStyles/style6/Two men standing on an unknown flat surface.jpg,Two men standing on an unknown flat surface
../../datasets/OldStyles/style6/Dan is happy about his doughnut with pink icing.jpg,Dan is happy about his doughnut with pink icing
../../datasets/OldStyles/style6/Sliced cheese pizza on a while plate with eating utensils.jpg,Sliced cheese pizza on a while plate with eating utensils
../../datasets/OldStyles/style6/It is out in the open with numerous things in perspective.jpg,It is out in the open with numerous things in perspective
../../datasets/OldStyles/style6/The desktop computer is placed next to a laptop.jpg,The desktop computer is placed next to a laptop
"../../datasets/OldStyles/style6/Two men, a boy and a girl playing with a Wii system.jpg","Two men, a boy and a girl playing with a Wii system"
../../datasets/OldStyles/style6/Many cars are parked along an empty highway.jpg,Many cars are parked along an empty highway
../../datasets/OldStyles/style6/A red Honesty Shop bus near the shade area.jpg,A red Honesty Shop bus near the shade area
../../datasets/OldStyles/style6/Two surfers ride a small wave with houses on a hillside in the background.jpg,Two surfers ride a small wave with houses on a hillside in the background
"../../datasets/OldStyles/style6/A bathroom with a toilet, small red trash can and green slippers.jpg","A bathroom with a toilet, small red trash can and green slippers"
../../datasets/OldStyles/style6/A black and white dog sleeping under a blanket on top of a pillow.jpg,A black and white dog sleeping under a blanket on top of a pillow
../../datasets/OldStyles/style6/Two tan double decker busses on road next to bridge.jpg,Two tan double decker busses on road next to bridge
../../datasets/OldStyles/style6/Two elephants in dirt field next to a wire fence.jpg,Two elephants in dirt field next to a wire fence
../../datasets/OldStyles/style6/A man swinging a tennis racket at an outdoor court.jpg,A man swinging a tennis racket at an outdoor court
../../datasets/OldStyles/style6/An industrial kitchen with a window into a dinning room.jpg,An industrial kitchen with a window into a dinning room
"../../datasets/OldStyles/style6/A chocolate-covered, frosted pastry with a cup of coffee in the background.jpg","A chocolate-covered, frosted pastry with a cup of coffee in the background"
../../datasets/OldStyles/style6/Two round sinks are in a wooden counter top next to a large mirror.jpg,Two round sinks are in a wooden counter top next to a large mirror
../../datasets/OldStyles/style6/A group of people holding a remote and ipad next to a monitor screen.jpg,A group of people holding a remote and ipad next to a monitor screen
../../datasets/OldStyles/style6/Two children color and cut out their artwork.jpg,Two children color and cut out their artwork
../../datasets/OldStyles/style6/A barista finishes preparing a cup of coffee.jpg,A barista finishes preparing a cup of coffee
../../datasets/OldStyles/style6/A child wearing a tie and a Cat in the Hat hat.jpg,A child wearing a tie and a Cat in the Hat hat
../../datasets/OldStyles/style6/Some surfboards that are in the dirt together.jpg,Some surfboards that are in the dirt together
../../datasets/OldStyles/style6/A bike parked in front of a metal bench.jpg,A bike parked in front of a metal bench
../../datasets/OldStyles/style6/A messy room with clothes scattered here and there.jpg,A messy room with clothes scattered here and there
../../datasets/OldStyles/style6/Two people are walking on the beach with three dogs.jpg,Two people are walking on the beach with three dogs
../../datasets/OldStyles/style6/A busy intersection in a city on a sunny day.jpg,A busy intersection in a city on a sunny day
../../datasets/OldStyles/style6/The couch with two throw pillows has a lamp beside it.jpg,The couch with two throw pillows has a lamp beside it
"../../datasets/OldStyles/style6/Two people are standing outside next to a dog, one is holding his hand in his pocket.jpg","Two people are standing outside next to a dog, one is holding his hand in his pocket"
../../datasets/OldStyles/style6/Street signs are shown on the sidewalk next to the road.jpg,Street signs are shown on the sidewalk next to the road
../../datasets/OldStyles/style6/two people in a field throwing a frisbee at a a device.jpg,two people in a field throwing a frisbee at a a device
../../datasets/OldStyles/style6/some kids are standing in a field playing sports.jpg,some kids are standing in a field playing sports
../../datasets/OldStyles/style6/a person riding a snow board on a snowy hill.jpg,a person riding a snow board on a snowy hill
../../datasets/OldStyles/style6/A pocket watch near a book shelf with books.jpg,A pocket watch near a book shelf with books
../../datasets/OldStyles/style6/A couple of construction vehicles under a traffic light.jpg,A couple of construction vehicles under a traffic light
"../../datasets/OldStyles/style6/A person is sitting in the grass, holding a paper plate with a picture of a face up to his face.jpg","A person is sitting in the grass, holding a paper plate with a picture of a face up to his face"
../../datasets/OldStyles/style6/A man sitting on a boat next to another boat full of supplies.jpg,A man sitting on a boat next to another boat full of supplies
../../datasets/OldStyles/style6/A blurry stop sign stands in the dark night.jpg,A blurry stop sign stands in the dark night
"../../datasets/OldStyles/style6/An umpire, catcher and batter wait for a pitch.jpg","An umpire, catcher and batter wait for a pitch"
../../datasets/OldStyles/style6/A man skis down a mountain slope by a barrier fence.jpg,A man skis down a mountain slope by a barrier fence
../../datasets/OldStyles/style6/The cow sticks its tongue out as is peers into the passenger side of the car.jpg,The cow sticks its tongue out as is peers into the passenger side of the car
../../datasets/OldStyles/style6/Three vintage propeller planes parked on the tarmac.jpg,Three vintage propeller planes parked on the tarmac
../../datasets/OldStyles/style6/An old woman feeds pigeons from her balcony.jpg,An old woman feeds pigeons from her balcony
../../datasets/OldStyles/style6/A brown table containing plates of food with dessert.jpg,A brown table containing plates of food with dessert
../../datasets/OldStyles/style6/A young boy at bat during a baseball game.jpg,A young boy at bat during a baseball game
../../datasets/OldStyles/style6/Children flying kites in a park on a sunny day.jpg,Children flying kites in a park on a sunny day
../../datasets/OldStyles/style6/A sink and toilet in a bathroom being remodeled.jpg,A sink and toilet in a bathroom being remodeled
../../datasets/OldStyles/style6/A laptop computer is sitting on a cluttered desk.jpg,A laptop computer is sitting on a cluttered desk
../../datasets/OldStyles/style6/This simple bathroom has a toilet in the corner.jpg,This simple bathroom has a toilet in the corner
../../datasets/OldStyles/style6/The parking meter in the black and white photo is near a stone wall.jpg,The parking meter in the black and white photo is near a stone wall
../../datasets/OldStyles/style6/a number of older people sitting at a table with wine glasses.jpg,a number of older people sitting at a table with wine glasses
../../datasets/OldStyles/style6/The people are drinking and playing video games together.jpg,The people are drinking and playing video games together
../../datasets/OldStyles/style6/A man helps a young girl with skiing gear.jpg,A man helps a young girl with skiing gear
../../datasets/OldStyles/style6/A table with a large amount of two kinds of apples.jpg,A table with a large amount of two kinds of apples
../../datasets/OldStyles/style6/Someone is standing over a tub with a bag being held.jpg,Someone is standing over a tub with a bag being held
../../datasets/OldStyles/style6/A man is surfing on a board in an ocean.jpg,A man is surfing on a board in an ocean
../../datasets/OldStyles/style6/A bowl filled with cake and ice cream.jpg,A bowl filled with cake and ice cream
../../datasets/OldStyles/style6/A bed sitting in a bedroom next to a window and framed pictures.jpg,A bed sitting in a bedroom next to a window and framed pictures
../../datasets/OldStyles/style6/man on cross country skis taking a break.jpg,man on cross country skis taking a break
../../datasets/OldStyles/style6/a plant with some tiny baby veggies growing on it.jpg,a plant with some tiny baby veggies growing on it
../../datasets/OldStyles/style6/Three oranges growing on a tree in the daytime.jpg,Three oranges growing on a tree in the daytime
../../datasets/OldStyles/style6/a person laying on a snowy surface wearing skis.jpg,a person laying on a snowy surface wearing skis
../../datasets/OldStyles/style6/A person on a skateboard riding on ramps.jpg,A person on a skateboard riding on ramps
../../datasets/OldStyles/style6/Woman with red plastic rain gear holding an umbrella.jpg,Woman with red plastic rain gear holding an umbrella
../../datasets/OldStyles/style6/A man sitting on a bench next to a bike.jpg,A man sitting on a bench next to a bike
../../datasets/OldStyles/style6/Several people are riding surf boards on the beach.jpg,Several people are riding surf boards on the beach
../../datasets/OldStyles/style6/A partially eaten triple layer cake on  a plate.jpg,A partially eaten triple layer cake on  a plate
../../datasets/OldStyles/style6/A black and white cat sleeping in the sun from the window.jpg,A black and white cat sleeping in the sun from the window
../../datasets/OldStyles/style6/Table with a microwave and television monitor on it.jpg,Table with a microwave and television monitor on it
../../datasets/OldStyles/style6/Two young men on boogie boards in the ocean.jpg,Two young men on boogie boards in the ocean
../../datasets/OldStyles/style6/A man holding a giant slice of cheese pizza.jpg,A man holding a giant slice of cheese pizza
../../datasets/OldStyles/style6/Motorcyclers in race leaning into a turn on the track.jpg,Motorcyclers in race leaning into a turn on the track
../../datasets/OldStyles/style6/This is a bathroom with a sink and a mirror.jpg,This is a bathroom with a sink and a mirror
../../datasets/OldStyles/style6/Cows standing and grazing in a green grassy field.jpg,Cows standing and grazing in a green grassy field
"../../datasets/OldStyles/style6/Raw carrot, broccoli and tomato with dip in a bowl.jpg","Raw carrot, broccoli and tomato with dip in a bowl"
../../datasets/OldStyles/style6/A plunger that is sitting in a toilet.jpg,A plunger that is sitting in a toilet
../../datasets/OldStyles/style6/A baseball player has just pitched a ball.jpg,A baseball player has just pitched a ball
../../datasets/OldStyles/style6/Blurry photograph of a surfer in a wetsuit catching a wave.jpg,Blurry photograph of a surfer in a wetsuit catching a wave
../../datasets/OldStyles/style6/A lady and a baby at a pizza parlor during the day.jpg,A lady and a baby at a pizza parlor during the day
../../datasets/OldStyles/style6/A dog smelling a treat on the floor.jpg,A dog smelling a treat on the floor
../../datasets/OldStyles/style6/A fruit and vegetable stand where produce is available for purchase.jpg,A fruit and vegetable stand where produce is available for purchase
../../datasets/OldStyles/style6/A mp3 player is connected to a laptop.jpg,A mp3 player is connected to a laptop
../../datasets/OldStyles/style6/a baseball pitcher on a field is throwing a ball.jpg,a baseball pitcher on a field is throwing a ball
../../datasets/OldStyles/style6/An assortment of vegetables is lined up on a cutting board.jpg,An assortment of vegetables is lined up on a cutting board
../../datasets/OldStyles/style6/Some cars waiting at a red light on the road.jpg,Some cars waiting at a red light on the road
"../../datasets/OldStyles/style6/a plate with carrots, meat and some sauce with a glass of wine next to it.jpg","a plate with carrots, meat and some sauce with a glass of wine next to it"
../../datasets/OldStyles/style6/a lady that is talking on a phone.jpg,a lady that is talking on a phone
../../datasets/OldStyles/style6/a person holding a deformed carrot in a kitchen.jpg,a person holding a deformed carrot in a kitchen
../../datasets/OldStyles/style6/A row of urinals in a public bathroom that has white tiles.jpg,A row of urinals in a public bathroom that has white tiles
../../datasets/OldStyles/style6/Asphalt road under some traffic lights surrounded by signs.jpg,Asphalt road under some traffic lights surrounded by signs
"../../datasets/OldStyles/style6/Plate with sandwich cut in half, fries pulled up and two pickles.jpg","Plate with sandwich cut in half, fries pulled up and two pickles"
../../datasets/OldStyles/style6/a close up of a person wearing a coat and holding a a baseball bat.jpg,a close up of a person wearing a coat and holding a a baseball bat
../../datasets/OldStyles/style6/There are three little boys sitting on the couch.jpg,There are three little boys sitting on the couch
"../../datasets/OldStyles/style6/A plate of meat and three vegetables - potatoes, carrots and corn.jpg","A plate of meat and three vegetables - potatoes, carrots and corn"
../../datasets/OldStyles/style6/A man in a chefs uniform is preparing food in a kitchen.jpg,A man in a chefs uniform is preparing food in a kitchen
../../datasets/OldStyles/style6/A bathroom with an non-enclosed shower next to the toilet.jpg,A bathroom with an non-enclosed shower next to the toilet
../../datasets/OldStyles/style6/That man must be the coach on a football team.jpg,That man must be the coach on a football team
../../datasets/OldStyles/style6/The bride cuts a cake with a saber at a military wedding.jpg,The bride cuts a cake with a saber at a military wedding
"../../datasets/OldStyles/style6/Six different pictures of food including a fruit bar, apple, soup, sandwich, lollipop, and french fries.jpg","Six different pictures of food including a fruit bar, apple, soup, sandwich, lollipop, and french fries"
../../datasets/OldStyles/style6/A rainbow lorikeet parrot eats sun flower seeds.jpg,A rainbow lorikeet parrot eats sun flower seeds
../../datasets/OldStyles/style6/A kitchen scene including an oven and a refrigerator.jpg,A kitchen scene including an oven and a refrigerator
../../datasets/OldStyles/style6/A cut in half sandwich sitting on top of a cutting board.jpg,A cut in half sandwich sitting on top of a cutting board
"../../datasets/OldStyles/style6/a kitchen with a stove, and sink with a hardwood floor.jpg","a kitchen with a stove, and sink with a hardwood floor"
"../../datasets/OldStyles/style6/Display of food items, vegetables and bottle of liquid.jpg","Display of food items, vegetables and bottle of liquid"
../../datasets/OldStyles/style6/Several sausages cooking on a grill over hot coals.jpg,Several sausages cooking on a grill over hot coals
../../datasets/OldStyles/style6/A bunch of skiers with the same team uniforms seem to be waiting in line.jpg,A bunch of skiers with the same team uniforms seem to be waiting in line
