image,text
../../datasets/OldStyles/style5/Four clocks hanging above a large open doorway.jpg,Four clocks hanging above a large open doorway
../../datasets/OldStyles/style5/Two bikers sit in field next to windows and talk.jpg,Two bikers sit in field next to windows and talk
../../datasets/OldStyles/style5/a plate with a hamburger and some brussel sprouts on it.jpg,a plate with a hamburger and some brussel sprouts on it
../../datasets/OldStyles/style5/a classic photograph of a man just after he has taken a swing at a pitch.jpg,a classic photograph of a man just after he has taken a swing at a pitch
../../datasets/OldStyles/style5/Two people sitting on horses next to each other.jpg,Two people sitting on horses next to each other
../../datasets/OldStyles/style5/A bowl with food that is sitting on a table.jpg,A bowl with food that is sitting on a table
../../datasets/OldStyles/style5/A man riding an elephant through the water.jpg,A man riding an elephant through the water
../../datasets/OldStyles/style5/People walking by a train at a train station.jpg,People walking by a train at a train station
../../datasets/OldStyles/style5/an image of a dog wearing a scarf on his neck.jpg,an image of a dog wearing a scarf on his neck
../../datasets/OldStyles/style5/A person on a dock near a boat in the water.jpg,A person on a dock near a boat in the water
../../datasets/OldStyles/style5/A bunch of different types of tools in a play kitchen.jpg,A bunch of different types of tools in a play kitchen
../../datasets/OldStyles/style5/a red and yellow fire hydrant snow trees and buildings.jpg,a red and yellow fire hydrant snow trees and buildings
../../datasets/OldStyles/style5/Smiling man holding a piece of paper with an illustration of a necktie.jpg,Smiling man holding a piece of paper with an illustration of a necktie
../../datasets/OldStyles/style5/Two brown bears meet while swimming in muddy water.jpg,Two brown bears meet while swimming in muddy water
../../datasets/OldStyles/style5/an image of a woman decorating a cake.jpg,an image of a woman decorating a cake
../../datasets/OldStyles/style5/A man cutting a cake on a table.jpg,A man cutting a cake on a table
../../datasets/OldStyles/style5/A photo looking down an alley at a clock tower.jpg,A photo looking down an alley at a clock tower
../../datasets/OldStyles/style5/A pastry made to look like a stick figure.jpg,A pastry made to look like a stick figure
../../datasets/OldStyles/style5/a train crossing safety guard is sitting erect.jpg,a train crossing safety guard is sitting erect
../../datasets/OldStyles/style5/A tennis player swings the racket back preparing to hit the ball.jpg,A tennis player swings the racket back preparing to hit the ball
../../datasets/OldStyles/style5/a group of people in a basement with wine glasses.jpg,a group of people in a basement with wine glasses
../../datasets/OldStyles/style5/A tong girl at a restaurant with broccoli on her plate.jpg,A tong girl at a restaurant with broccoli on her plate
../../datasets/OldStyles/style5/A man poses leaning against a refrigerator with an empty box in front of him.jpg,A man poses leaning against a refrigerator with an empty box in front of him
../../datasets/OldStyles/style5/A couple of ladies are playing the Nintendo Wii.jpg,A couple of ladies are playing the Nintendo Wii
../../datasets/OldStyles/style5/A bathroom mirror shows a person taking a picture of a large bathroom.jpg,A bathroom mirror shows a person taking a picture of a large bathroom
../../datasets/OldStyles/style5/A tennis player draws his arm back to hit the ball.jpg,A tennis player draws his arm back to hit the ball
../../datasets/OldStyles/style5/A bag of coffee sits on a table next to an open lap top.jpg,A bag of coffee sits on a table next to an open lap top
../../datasets/OldStyles/style5/A woman holds up a can of drink in front of pizzas.jpg,A woman holds up a can of drink in front of pizzas
../../datasets/OldStyles/style5/A cooked pizza that has been placed on a table.jpg,A cooked pizza that has been placed on a table
../../datasets/OldStyles/style5/A tall clock sitting next to two tall poles.jpg,A tall clock sitting next to two tall poles
../../datasets/OldStyles/style5/A man in an office holding a box of giant doughnuts.jpg,A man in an office holding a box of giant doughnuts
../../datasets/OldStyles/style5/A view of a woman through a wine glass.jpg,A view of a woman through a wine glass
../../datasets/OldStyles/style5/There is a laptop that has two mouses.jpg,There is a laptop that has two mouses
../../datasets/OldStyles/style5/The small bathroom has blue tile on the floor.jpg,The small bathroom has blue tile on the floor
../../datasets/OldStyles/style5/A man in a chef hat cuts up an apple at an outdoor camping kitchen.jpg,A man in a chef hat cuts up an apple at an outdoor camping kitchen
../../datasets/OldStyles/style5/A man holding a laptop facing away from himself.jpg,A man holding a laptop facing away from himself
../../datasets/OldStyles/style5/A model set of cars and other vehicles with a garage.jpg,A model set of cars and other vehicles with a garage
../../datasets/OldStyles/style5/Motor vehicle traffic on a paved city road.jpg,Motor vehicle traffic on a paved city road
../../datasets/OldStyles/style5/A brown teddy bear sitting next to a white tray on a table.jpg,A brown teddy bear sitting next to a white tray on a table
"../../datasets/OldStyles/style5/A cat starring at you, and a HD TV in the background.jpg","A cat starring at you, and a HD TV in the background"
../../datasets/OldStyles/style5/Lone male surfer riding a wave of jade green water.jpg,Lone male surfer riding a wave of jade green water
../../datasets/OldStyles/style5/Someone feeding cake to a little girl in a bathing suit.jpg,Someone feeding cake to a little girl in a bathing suit
../../datasets/OldStyles/style5/A young boy smiles as the giraffe looks to eat from his hand.jpg,A young boy smiles as the giraffe looks to eat from his hand
../../datasets/OldStyles/style5/A guy on a very cool looking scooter by the road.jpg,A guy on a very cool looking scooter by the road
../../datasets/OldStyles/style5/A woman standing on a tennis court holding a tennis racquet.jpg,A woman standing on a tennis court holding a tennis racquet
../../datasets/OldStyles/style5/A black motorcycle parked in the sand with the helmet and a bag sitting on the seat.jpg,A black motorcycle parked in the sand with the helmet and a bag sitting on the seat
../../datasets/OldStyles/style5/Green plant sitting in front of a bowl of oranges.jpg,Green plant sitting in front of a bowl of oranges
../../datasets/OldStyles/style5/A rather chunky cat sitting under a plaid umbrella.jpg,A rather chunky cat sitting under a plaid umbrella
../../datasets/OldStyles/style5/A large brown truck on display at a car show.jpg,A large brown truck on display at a car show
../../datasets/OldStyles/style5/A city bus is stopped on the street by the stop.jpg,A city bus is stopped on the street by the stop
../../datasets/OldStyles/style5/a close up of a street sign with a sky background.jpg,a close up of a street sign with a sky background
../../datasets/OldStyles/style5/Packs of tuna are on the counter in front of a microwave.jpg,Packs of tuna are on the counter in front of a microwave
"../../datasets/OldStyles/style5/A kitchen area with table, stove and a refrigerator.jpg","A kitchen area with table, stove and a refrigerator"
../../datasets/OldStyles/style5/A group of elephants walking towards a brown cow.jpg,A group of elephants walking towards a brown cow
../../datasets/OldStyles/style5/A bush is growing next to an old fire hydrant.jpg,A bush is growing next to an old fire hydrant
../../datasets/OldStyles/style5/A group of people walking an adorable dog across a walkway.jpg,A group of people walking an adorable dog across a walkway
../../datasets/OldStyles/style5/tow military men in uniforms shaking hands in hallway.jpg,tow military men in uniforms shaking hands in hallway
../../datasets/OldStyles/style5/She sure is rocking it out with her hairdryer.jpg,She sure is rocking it out with her hairdryer
../../datasets/OldStyles/style5/The tower of the building has a clock displayed on the front of it.jpg,The tower of the building has a clock displayed on the front of it
../../datasets/OldStyles/style5/an image of a woman on skiis posing.jpg,an image of a woman on skiis posing
../../datasets/OldStyles/style5/A blue and silver train traveling on the tracks.jpg,A blue and silver train traveling on the tracks
../../datasets/OldStyles/style5/A wedding cake with a bride and groom on top.jpg,A wedding cake with a bride and groom on top
"../../datasets/OldStyles/style5/A view of a toilet, with the room barren.jpg","A view of a toilet, with the room barren"
../../datasets/OldStyles/style5/A large passenger jet flying through a cloudy blue sky.jpg,A large passenger jet flying through a cloudy blue sky
../../datasets/OldStyles/style5/Some sheep are eating hay in a snowy field.jpg,Some sheep are eating hay in a snowy field
../../datasets/OldStyles/style5/A guy rides along some barriers with his skateboard.jpg,A guy rides along some barriers with his skateboard
../../datasets/OldStyles/style5/An elephant hoof gets marked as it extends from its enclosure.jpg,An elephant hoof gets marked as it extends from its enclosure
../../datasets/OldStyles/style5/An adult giraffe basking in the shade at a zoo.jpg,An adult giraffe basking in the shade at a zoo
../../datasets/OldStyles/style5/Lots of kites being flown in a parking lot.jpg,Lots of kites being flown in a parking lot
../../datasets/OldStyles/style5/A man looking a supreme pizza in a kitchen.jpg,A man looking a supreme pizza in a kitchen
../../datasets/OldStyles/style5/A red bus passes by an old church and statue.jpg,A red bus passes by an old church and statue
../../datasets/OldStyles/style5/A set of blue and white stairs at the end of a living room.jpg,A set of blue and white stairs at the end of a living room
../../datasets/OldStyles/style5/An extreme close up of the green portion of a stop light.jpg,An extreme close up of the green portion of a stop light
../../datasets/OldStyles/style5/A man looks a donut hanging from a string.jpg,A man looks a donut hanging from a string
../../datasets/OldStyles/style5/Two giraffes walking in a tall dry grass in front of a mountain range.jpg,Two giraffes walking in a tall dry grass in front of a mountain range
../../datasets/OldStyles/style5/A man wearing a hat and a black tie.jpg,A man wearing a hat and a black tie
../../datasets/OldStyles/style5/An up side down photo of a parking lot and a dog following a bicycle rider.jpg,An up side down photo of a parking lot and a dog following a bicycle rider
../../datasets/OldStyles/style5/Two elephants in dirt field next to a wire fence.jpg,Two elephants in dirt field next to a wire fence
../../datasets/OldStyles/style5/Bags of luggage are placed in a cart.jpg,Bags of luggage are placed in a cart
../../datasets/OldStyles/style5/a train on a track near a high way.jpg,a train on a track near a high way
../../datasets/OldStyles/style5/A single zebra grazing in a rocky enclosure.jpg,A single zebra grazing in a rocky enclosure
../../datasets/OldStyles/style5/Two people standing next to a large motorcycle.jpg,Two people standing next to a large motorcycle
../../datasets/OldStyles/style5/The woman's  on the horse giving presentation with flags.jpg,The woman's  on the horse giving presentation with flags
"../../datasets/OldStyles/style5/A large group of people, some with skateboards, up against a wall.jpg","A large group of people, some with skateboards, up against a wall"
../../datasets/OldStyles/style5/A warm cheese pizza sits on an open table.jpg,A warm cheese pizza sits on an open table
../../datasets/OldStyles/style5/there are two lap tops sitting on a large table.jpg,there are two lap tops sitting on a large table
../../datasets/OldStyles/style5/A view from far of a male surfer in the water.jpg,A view from far of a male surfer in the water
../../datasets/OldStyles/style5/A full view of a messy bed with the blanket down on the floor.jpg,A full view of a messy bed with the blanket down on the floor
../../datasets/OldStyles/style5/A group of officers on motorcycles next to a building.jpg,A group of officers on motorcycles next to a building
../../datasets/OldStyles/style5/Lots of sheep out on a field during the day.jpg,Lots of sheep out on a field during the day
../../datasets/OldStyles/style5/This is the moment of impact when the ball hits the bat.jpg,This is the moment of impact when the ball hits the bat
"../../datasets/OldStyles/style5/Coffee, orange juice, toast, and cereal sitting on a table outside.jpg","Coffee, orange juice, toast, and cereal sitting on a table outside"
../../datasets/OldStyles/style5/A couple of cops riding on the back of motorcycles.jpg,A couple of cops riding on the back of motorcycles
../../datasets/OldStyles/style5/an angry birds themed birthday cake on a wooden table.jpg,an angry birds themed birthday cake on a wooden table
../../datasets/OldStyles/style5/Traffic signs and cones directing vehicles on a street.jpg,Traffic signs and cones directing vehicles on a street
../../datasets/OldStyles/style5/A person on skis standing in the snow on a ski slope.jpg,A person on skis standing in the snow on a ski slope
../../datasets/OldStyles/style5/An elegant cathedral on a bright blue day.jpg,An elegant cathedral on a bright blue day
../../datasets/OldStyles/style5/A chocolate birthday cake with lite candles on top of it.jpg,A chocolate birthday cake with lite candles on top of it
../../datasets/OldStyles/style5/A case and couple notebooks on a table.jpg,A case and couple notebooks on a table
"../../datasets/OldStyles/style5/The photo is taken at the bottom of the ski slope, in view of several skiers are coming down  several  ready to board the ski lifts.jpg","The photo is taken at the bottom of the ski slope, in view of several skiers are coming down  several  ready to board the ski lifts"
../../datasets/OldStyles/style5/A boat with a dog sitting on it and two people riding in it.jpg,A boat with a dog sitting on it and two people riding in it
../../datasets/OldStyles/style5/A blender filled with banana slices and fruit.jpg,A blender filled with banana slices and fruit
../../datasets/OldStyles/style5/Side view of a giant Aeroflot Russian Airlines Airplane.jpg,Side view of a giant Aeroflot Russian Airlines Airplane
../../datasets/OldStyles/style5/Young men playing with a frisbee in a park.jpg,Young men playing with a frisbee in a park
../../datasets/OldStyles/style5/A dessert plate that has fruit and cake.jpg,A dessert plate that has fruit and cake
../../datasets/OldStyles/style5/An elephant touches his trunk to a woman's hand.jpg,An elephant touches his trunk to a woman's hand
../../datasets/OldStyles/style5/People getting on a triple decker bus on display.jpg,People getting on a triple decker bus on display
../../datasets/OldStyles/style5/Two Zebras are eating plants in a field.jpg,Two Zebras are eating plants in a field
"../../datasets/OldStyles/style5/A small snack of crackers, carrots, strawberries, and a bowl of Oatmeal.jpg","A small snack of crackers, carrots, strawberries, and a bowl of Oatmeal"
../../datasets/OldStyles/style5/A bunch of speedboats near a harbor with flags from all over the world.jpg,A bunch of speedboats near a harbor with flags from all over the world
"../../datasets/OldStyles/style5/Yellow, orange and pink flowers adorn a balcony railing.jpg","Yellow, orange and pink flowers adorn a balcony railing"
../../datasets/OldStyles/style5/A person placing tomato sauce on a pizza.jpg,A person placing tomato sauce on a pizza
../../datasets/OldStyles/style5/A propeller plan that is sitting on concrete.jpg,A propeller plan that is sitting on concrete
../../datasets/OldStyles/style5/there are many elephants that can be seen in the wild.jpg,there are many elephants that can be seen in the wild
../../datasets/OldStyles/style5/A zebra is walking on the dirt next to a field.jpg,A zebra is walking on the dirt next to a field
../../datasets/OldStyles/style5/a man in a suit and tie walking down a busy sidewalk.jpg,a man in a suit and tie walking down a busy sidewalk
../../datasets/OldStyles/style5/A person is trying to fly a kite in a large grassy field.jpg,A person is trying to fly a kite in a large grassy field
../../datasets/OldStyles/style5/A bicycle that is being slowly covered over by some vines.jpg,A bicycle that is being slowly covered over by some vines
../../datasets/OldStyles/style5/Giraffes in an enclosure near a stone wall.jpg,Giraffes in an enclosure near a stone wall
../../datasets/OldStyles/style5/Looking down a dirt road past the horse pulling a wagon.jpg,Looking down a dirt road past the horse pulling a wagon
../../datasets/OldStyles/style5/Beautiful antique black vases on a stone balcony filled with pink flowers and a statue in the distance.jpg,Beautiful antique black vases on a stone balcony filled with pink flowers and a statue in the distance
../../datasets/OldStyles/style5/A cay laying on a mans lap near a game controller.jpg,A cay laying on a mans lap near a game controller
../../datasets/OldStyles/style5/white polar bear walking on the the white snowy ground.jpg,white polar bear walking on the the white snowy ground
../../datasets/OldStyles/style5/a group of people huddled together in a street holding umbrellas.jpg,a group of people huddled together in a street holding umbrellas
../../datasets/OldStyles/style5/a close up of a plate of pizza on a table.jpg,a close up of a plate of pizza on a table
../../datasets/OldStyles/style5/giraffes standing in the shade by a building.jpg,giraffes standing in the shade by a building
../../datasets/OldStyles/style5/a girl riding a bike wth a dog chasing her.jpg,a girl riding a bike wth a dog chasing her
../../datasets/OldStyles/style5/A young man and woman playing a WII game in their living room.jpg,A young man and woman playing a WII game in their living room
../../datasets/OldStyles/style5/a bear is walking down a grass path.jpg,a bear is walking down a grass path
../../datasets/OldStyles/style5/Lion on the side of the road eating a zebra.jpg,Lion on the side of the road eating a zebra
../../datasets/OldStyles/style5/man on cross country skis taking a break.jpg,man on cross country skis taking a break
../../datasets/OldStyles/style5/A small child in a blue shirt carrying a bag of apples.jpg,A small child in a blue shirt carrying a bag of apples
../../datasets/OldStyles/style5/A man gives two elephants water from a hose.jpg,A man gives two elephants water from a hose
../../datasets/OldStyles/style5/A man that is on ski's in the snow.jpg,A man that is on ski's in the snow
../../datasets/OldStyles/style5/A young lady crossing the road with her dog on a leash.jpg,A young lady crossing the road with her dog on a leash
../../datasets/OldStyles/style5/People standing and watching a skateboard race outside.jpg,People standing and watching a skateboard race outside
../../datasets/OldStyles/style5/Several wine glasses have just a little bit of wine in each of them.jpg,Several wine glasses have just a little bit of wine in each of them
../../datasets/OldStyles/style5/a boy doing a skateboard trick on the edge of a half pipe.jpg,a boy doing a skateboard trick on the edge of a half pipe
../../datasets/OldStyles/style5/A man sits on a snowboard while other people observe an event.jpg,A man sits on a snowboard while other people observe an event
../../datasets/OldStyles/style5/Two people with surf boards are walking near the ocean.jpg,Two people with surf boards are walking near the ocean
../../datasets/OldStyles/style5/A big gold clock with forks and spoons.jpg,A big gold clock with forks and spoons
../../datasets/OldStyles/style5/A white bird in water next to rocks.jpg,A white bird in water next to rocks
../../datasets/OldStyles/style5/Two old fashioned steam railroad trains are on the tracks.jpg,Two old fashioned steam railroad trains are on the tracks
../../datasets/OldStyles/style5/A young boy bits into some food purchased from a food cart outside.jpg,A young boy bits into some food purchased from a food cart outside
../../datasets/OldStyles/style5/A black and white photo of a children's luggage case.jpg,A black and white photo of a children's luggage case
../../datasets/OldStyles/style5/A train traveling down train tracks near a forest.jpg,A train traveling down train tracks near a forest
../../datasets/OldStyles/style5/Weary travelers get off a bus and collect their luggage from a table.jpg,Weary travelers get off a bus and collect their luggage from a table
../../datasets/OldStyles/style5/Two giraffes feed from a pole with an urban skyline in the background.jpg,Two giraffes feed from a pole with an urban skyline in the background
../../datasets/OldStyles/style5/A skier dressed in blue traveling down a snowy slope.jpg,A skier dressed in blue traveling down a snowy slope
../../datasets/OldStyles/style5/A train on the tracks parked in a train station.jpg,A train on the tracks parked in a train station
../../datasets/OldStyles/style5/a boat sitting next to a quiet pier.jpg,a boat sitting next to a quiet pier
../../datasets/OldStyles/style5/A cat sitting on a tiled floor next to a wooden desk.jpg,A cat sitting on a tiled floor next to a wooden desk
"../../datasets/OldStyles/style5/Several dishes, bowls and silverware are on top of polka dotted place mats.jpg","Several dishes, bowls and silverware are on top of polka dotted place mats"
../../datasets/OldStyles/style5/A long yellow bus is going by a large building.jpg,A long yellow bus is going by a large building
"../../datasets/OldStyles/style5/A group of elephants walking down the road, holding tails.jpg","A group of elephants walking down the road, holding tails"
../../datasets/OldStyles/style5/A cat is laying on the top of a refrigerator in a kitchen.jpg,A cat is laying on the top of a refrigerator in a kitchen
../../datasets/OldStyles/style5/A MAN IS ON THE SNOW BOARD IN THE SNOW.jpg,A MAN IS ON THE SNOW BOARD IN THE SNOW
../../datasets/OldStyles/style5/A person sitting on the back of a horse that is standing on its hind legs.jpg,A person sitting on the back of a horse that is standing on its hind legs
../../datasets/OldStyles/style5/Two children wearing helmets are skiing through the snow.jpg,Two children wearing helmets are skiing through the snow
../../datasets/OldStyles/style5/Five brown ducks standing around in the brush.jpg,Five brown ducks standing around in the brush
../../datasets/OldStyles/style5/An orange motorcylce parked next to other motor scooters and cycles.jpg,An orange motorcylce parked next to other motor scooters and cycles
../../datasets/OldStyles/style5/A baseball player sliding into a base as the baseman tries to catch the ball.jpg,A baseball player sliding into a base as the baseman tries to catch the ball
../../datasets/OldStyles/style5/A baseball player takes a swing at a low ball.jpg,A baseball player takes a swing at a low ball
../../datasets/OldStyles/style5/Two bulls are resting on the sand next to a boat.jpg,Two bulls are resting on the sand next to a boat
../../datasets/OldStyles/style5/A  car parked behind a wooden bench.jpg,A  car parked behind a wooden bench
../../datasets/OldStyles/style5/Two black birds resting on a wooden bench.jpg,Two black birds resting on a wooden bench
../../datasets/OldStyles/style5/People in a park trying to fly a large purple kite that looks like a fish.jpg,People in a park trying to fly a large purple kite that looks like a fish
../../datasets/OldStyles/style5/the giraffes are all standing next to a tree and eating.jpg,the giraffes are all standing next to a tree and eating
../../datasets/OldStyles/style5/A small child wearing skis on the snow.jpg,A small child wearing skis on the snow
../../datasets/OldStyles/style5/The bagels are made into tasty sandwiches at the bakery.jpg,The bagels are made into tasty sandwiches at the bakery
../../datasets/OldStyles/style5/A set of three trains traveling down train tracks.jpg,A set of three trains traveling down train tracks
../../datasets/OldStyles/style5/A red stop sign sitting next to a hazard sign.jpg,A red stop sign sitting next to a hazard sign
../../datasets/OldStyles/style5/A small group of skateboarders relaxing during a break from practice.jpg,A small group of skateboarders relaxing during a break from practice
../../datasets/OldStyles/style5/A cat with a tooth brush in it's mouth.jpg,A cat with a tooth brush in it's mouth
../../datasets/OldStyles/style5/A small dog in the back compartment of a backpack.jpg,A small dog in the back compartment of a backpack
../../datasets/OldStyles/style5/A white plate with some doughnuts on it.jpg,A white plate with some doughnuts on it
../../datasets/OldStyles/style5/two zebras standing around a metal pole.jpg,two zebras standing around a metal pole
../../datasets/OldStyles/style5/Many people in a huge field flying kites near some water.jpg,Many people in a huge field flying kites near some water
../../datasets/OldStyles/style5/there is a plane flying very high in the sky.jpg,there is a plane flying very high in the sky
../../datasets/OldStyles/style5/A double-decker bus on a street in a large city.jpg,A double-decker bus on a street in a large city
../../datasets/OldStyles/style5/a black bear sitting by some grass.jpg,a black bear sitting by some grass
../../datasets/OldStyles/style5/Group of people holding a demonstration in front of a crowd.jpg,Group of people holding a demonstration in front of a crowd
../../datasets/OldStyles/style5/Cut up carrots fry in a large skillet.jpg,Cut up carrots fry in a large skillet
../../datasets/OldStyles/style5/A table an bench on the beach near the water.jpg,A table an bench on the beach near the water
