image,text
../../datasets/OldStyles/style5/A fancy bathroom has a bathtub that's yellow and brown.jpg,A fancy bathroom has a bathtub that's yellow and brown
../../datasets/OldStyles/style5/Two people are playing a remote controlled video game.jpg,Two people are playing a remote controlled video game
../../datasets/OldStyles/style5/A close shot of a stop sign in a suburban area.jpg,A close shot of a stop sign in a suburban area
../../datasets/OldStyles/style5/A lady messes with a plate of food in an oven.jpg,A lady messes with a plate of food in an oven
../../datasets/OldStyles/style5/A green street lamp next to a brick building.jpg,A green street lamp next to a brick building
../../datasets/OldStyles/style5/A small brown dog sticking it's head out of a car window.jpg,A small brown dog sticking it's head out of a car window
../../datasets/OldStyles/style5/a living room with a low ceiling and it has a couple of couches.jpg,a living room with a low ceiling and it has a couple of couches
../../datasets/OldStyles/style5/a dog wrapped in a blanket while sleeping on a  bed.jpg,a dog wrapped in a blanket while sleeping on a  bed
../../datasets/OldStyles/style5/A man smiles as he stands next to an open toilet.jpg,A man smiles as he stands next to an open toilet
../../datasets/OldStyles/style5/A WOMAN IS STANDGN ON THE SNOW ON A BOARD.jpg,A WOMAN IS STANDGN ON THE SNOW ON A BOARD
../../datasets/OldStyles/style5/Two boys are skateboarding on the concrete near the ocean.jpg,Two boys are skateboarding on the concrete near the ocean
../../datasets/OldStyles/style5/a number of figurines on a box on a wall.jpg,a number of figurines on a box on a wall
../../datasets/OldStyles/style5/Cows in a field in front of houses.jpg,Cows in a field in front of houses
../../datasets/OldStyles/style5/Person holding up a cellphone and a small piece of paper.jpg,Person holding up a cellphone and a small piece of paper
../../datasets/OldStyles/style5/A snowboarder is doing stunts in the snow.jpg,A snowboarder is doing stunts in the snow
../../datasets/OldStyles/style5/Two women playing wii tennis in front of a television.jpg,Two women playing wii tennis in front of a television
../../datasets/OldStyles/style5/A woman standing next to limes for sale.jpg,A woman standing next to limes for sale
../../datasets/OldStyles/style5/A man is riding a motorcycle in a santa suit.jpg,A man is riding a motorcycle in a santa suit
../../datasets/OldStyles/style5/a giraffe sticks its head through a fence eating a carrot.jpg,a giraffe sticks its head through a fence eating a carrot
../../datasets/OldStyles/style5/A baby sitting on the floor using a toothbrush.jpg,A baby sitting on the floor using a toothbrush
../../datasets/OldStyles/style5/a person carrying a surfboard out to the water of a beach.jpg,a person carrying a surfboard out to the water of a beach
../../datasets/OldStyles/style5/A snowboarder practicing on a warm weather slope.jpg,A snowboarder practicing on a warm weather slope
../../datasets/OldStyles/style5/Two young boys compete at soccer while an adult watches.jpg,Two young boys compete at soccer while an adult watches
../../datasets/OldStyles/style5/A man in a blue jacket lighting a cigarette.jpg,A man in a blue jacket lighting a cigarette
"../../datasets/OldStyles/style5/Seen from below, a polar bear standing in a glass bottom pool.jpg","Seen from below, a polar bear standing in a glass bottom pool"
../../datasets/OldStyles/style5/A stop sign with graffiti on the bottom of it.jpg,A stop sign with graffiti on the bottom of it
../../datasets/OldStyles/style5/Man and woman shopping in a produce market.jpg,Man and woman shopping in a produce market
../../datasets/OldStyles/style5/A boy on a scooter has a skate park all to himself.jpg,A boy on a scooter has a skate park all to himself
../../datasets/OldStyles/style5/A cat sitting in a suitcase with clothes in it.jpg,A cat sitting in a suitcase with clothes in it
../../datasets/OldStyles/style5/A toy carrot and another figurine on a cake.jpg,A toy carrot and another figurine on a cake
../../datasets/OldStyles/style5/white airplane with the wording AirFrance on runway.jpg,white airplane with the wording AirFrance on runway
../../datasets/OldStyles/style5/A woman cutting into a pizza with silverware and a smile on her face.jpg,A woman cutting into a pizza with silverware and a smile on her face
../../datasets/OldStyles/style5/A dead deer is laying on the road.jpg,A dead deer is laying on the road
../../datasets/OldStyles/style5/A man standing on a train holding a cell phone.jpg,A man standing on a train holding a cell phone
../../datasets/OldStyles/style5/A row of parked buses sitting in a  parking lot.jpg,A row of parked buses sitting in a  parking lot
../../datasets/OldStyles/style5/People walking and playing along an ocean shoreline.jpg,People walking and playing along an ocean shoreline
../../datasets/OldStyles/style5/a herd of horses on the side of a hill.jpg,a herd of horses on the side of a hill
../../datasets/OldStyles/style5/Zebras and antelopes in a field of dried grass.jpg,Zebras and antelopes in a field of dried grass
../../datasets/OldStyles/style5/A passenger train that is pulling into a station.jpg,A passenger train that is pulling into a station
../../datasets/OldStyles/style5/A man standing on the side of a snow covered mountain on skis.jpg,A man standing on the side of a snow covered mountain on skis
../../datasets/OldStyles/style5/A black cat laying on a couch with a colorful toy.jpg,A black cat laying on a couch with a colorful toy
../../datasets/OldStyles/style5/A guy walks a dog near some buses.jpg,A guy walks a dog near some buses
../../datasets/OldStyles/style5/Several people sitting at a table that has a pizza on it.jpg,Several people sitting at a table that has a pizza on it
../../datasets/OldStyles/style5/A ski lift with people in front on skis and walking in the snow.jpg,A ski lift with people in front on skis and walking in the snow
../../datasets/OldStyles/style5/Three giraffes roaming around the ground trying to eat leaves.jpg,Three giraffes roaming around the ground trying to eat leaves
"../../datasets/OldStyles/style5/a display of giraffes, zebras and elephants in a building.jpg","a display of giraffes, zebras and elephants in a building"
../../datasets/OldStyles/style5/A very tall brick clock tower stating time of 5,A very tall brick clock tower stating time of 5
../../datasets/OldStyles/style5/A skier walking in the snow on their skis.jpg,A skier walking in the snow on their skis
../../datasets/OldStyles/style5/A couple of brown cows standing in the middle of a field.jpg,A couple of brown cows standing in the middle of a field
../../datasets/OldStyles/style5/The dog is standing between the seats of a car.jpg,The dog is standing between the seats of a car
../../datasets/OldStyles/style5/There are many street and traffic signs in the busy city.jpg,There are many street and traffic signs in the busy city
../../datasets/OldStyles/style5/an elephant walking by the edge of it's territory in the park.jpg,an elephant walking by the edge of it's territory in the park
../../datasets/OldStyles/style5/Two people standing in a hallway of their home looking at a floor fan.jpg,Two people standing in a hallway of their home looking at a floor fan
../../datasets/OldStyles/style5/The view of a knife slicing in to an apple.jpg,The view of a knife slicing in to an apple
../../datasets/OldStyles/style5/A person jumping to hit a tennis ball on a tennis court.jpg,A person jumping to hit a tennis ball on a tennis court
../../datasets/OldStyles/style5/two giraffes standing under a tree and eating the leaves.jpg,two giraffes standing under a tree and eating the leaves
../../datasets/OldStyles/style5/Bottle water next to computer on table in backyard of residence.jpg,Bottle water next to computer on table in backyard of residence
../../datasets/OldStyles/style5/Small work space with desk and large monitor in non office setting.jpg,Small work space with desk and large monitor in non office setting
../../datasets/OldStyles/style5/A man on using his laptop alone on a chair against the wall in a room.jpg,A man on using his laptop alone on a chair against the wall in a room
../../datasets/OldStyles/style5/A person on a skate board in the air near a ramp.jpg,A person on a skate board in the air near a ramp
../../datasets/OldStyles/style5/Baby elephant is snuggling near his mother.jpg,Baby elephant is snuggling near his mother
../../datasets/OldStyles/style5/A large vase fountain surrounded by purple flowers.jpg,A large vase fountain surrounded by purple flowers
../../datasets/OldStyles/style5/The man with a bike is watching large colorful kites.jpg,The man with a bike is watching large colorful kites
../../datasets/OldStyles/style5/a magnetic knife holder on the wall above a kitchen counter.jpg,a magnetic knife holder on the wall above a kitchen counter
../../datasets/OldStyles/style5/Two people are walking towards the ocean with surf boards.jpg,Two people are walking towards the ocean with surf boards
../../datasets/OldStyles/style5/A trio of children take bites from hot dogs at an outdoor event.jpg,A trio of children take bites from hot dogs at an outdoor event
../../datasets/OldStyles/style5/A group of adult and baby elephants in an enclosure.jpg,A group of adult and baby elephants in an enclosure
../../datasets/OldStyles/style5/A laptop computer on a metal stand at the edge of a park.jpg,A laptop computer on a metal stand at the edge of a park
../../datasets/OldStyles/style5/a double Decker bus that is parked by a building.jpg,a double Decker bus that is parked by a building
../../datasets/OldStyles/style5/A shirtless man lays on a bed and smiles.jpg,A shirtless man lays on a bed and smiles
../../datasets/OldStyles/style5/a couple of women are sitting around a white table.jpg,a couple of women are sitting around a white table
../../datasets/OldStyles/style5/Three men standing on wet ground flying a kite.jpg,Three men standing on wet ground flying a kite
../../datasets/OldStyles/style5/A slice of caked covered in vanilla frosting on a table.jpg,A slice of caked covered in vanilla frosting on a table
../../datasets/OldStyles/style5/A photo of someone's bedroom with a large collection of books.jpg,A photo of someone's bedroom with a large collection of books
../../datasets/OldStyles/style5/A person that is looking at the camera.jpg,A person that is looking at the camera
../../datasets/OldStyles/style5/A cat laying across a red velvet chair.jpg,A cat laying across a red velvet chair
../../datasets/OldStyles/style5/A view of a couple of pizzas with water on the table.jpg,A view of a couple of pizzas with water on the table
../../datasets/OldStyles/style5/A plate of pizza is sitting on the table in the restaurant.jpg,A plate of pizza is sitting on the table in the restaurant
../../datasets/OldStyles/style5/There is a closed garage door under a sign.jpg,There is a closed garage door under a sign
../../datasets/OldStyles/style5/Red-tail Hawk perched atop a speed limit sign.jpg,Red-tail Hawk perched atop a speed limit sign
../../datasets/OldStyles/style5/a banana and another piece of fruit on a table.jpg,a banana and another piece of fruit on a table
../../datasets/OldStyles/style5/Two zebras eating grasses in their natural habitat.jpg,Two zebras eating grasses in their natural habitat
../../datasets/OldStyles/style5/a dog sleeping on the sidewalk whiile people walk by.jpg,a dog sleeping on the sidewalk whiile people walk by
../../datasets/OldStyles/style5/A man driving a train down a train track outside.jpg,A man driving a train down a train track outside
../../datasets/OldStyles/style5/A man looking at the selections in a wine store.jpg,A man looking at the selections in a wine store
../../datasets/OldStyles/style5/An elephant standing next to a stone wall.jpg,An elephant standing next to a stone wall
../../datasets/OldStyles/style5/A white and blue biplane flying over trees in hazy sky.jpg,A white and blue biplane flying over trees in hazy sky
../../datasets/OldStyles/style5/A man is trying to hit a tennis ball with a racket.jpg,A man is trying to hit a tennis ball with a racket
../../datasets/OldStyles/style5/A horse and dog licking each other in front of a woman.jpg,A horse and dog licking each other in front of a woman
../../datasets/OldStyles/style5/Blue and white bathroom with toilet and bathtub.jpg,Blue and white bathroom with toilet and bathtub
../../datasets/OldStyles/style5/A cat with a irritated look sitting on a bed.jpg,A cat with a irritated look sitting on a bed
../../datasets/OldStyles/style5/People are riding in a boat down a canal between buildings.jpg,People are riding in a boat down a canal between buildings
../../datasets/OldStyles/style5/The red meat entree is topped off with a cherry.jpg,The red meat entree is topped off with a cherry
../../datasets/OldStyles/style5/a bathroom with a tub and sink and a large mirror.jpg,a bathroom with a tub and sink and a large mirror
../../datasets/OldStyles/style5/Young gray elephant walking through water spraying water from trunk.jpg,Young gray elephant walking through water spraying water from trunk
../../datasets/OldStyles/style5/A large knife and some sliced carrots on a cutting board.jpg,A large knife and some sliced carrots on a cutting board
../../datasets/OldStyles/style5/A guy snow boarding on a beautiful day.jpg,A guy snow boarding on a beautiful day
"../../datasets/OldStyles/style5/Arrangement of wholesome meal, with utensils on side.jpg","Arrangement of wholesome meal, with utensils on side"
"../../datasets/OldStyles/style5/A living room with photos, bags and a laptop on the floor.jpg","A living room with photos, bags and a laptop on the floor"
../../datasets/OldStyles/style5/Many people rowing a boat and surfing side by side.jpg,Many people rowing a boat and surfing side by side
../../datasets/OldStyles/style5/Two bicycles are next to the wall with a cat.jpg,Two bicycles are next to the wall with a cat
../../datasets/OldStyles/style5/A horse pulled carriage on a open street.jpg,A horse pulled carriage on a open street
../../datasets/OldStyles/style5/a owl that is sitting in a cage on a branch.jpg,a owl that is sitting in a cage on a branch
../../datasets/OldStyles/style5/A stainless steel refrigerator that has its door open.jpg,A stainless steel refrigerator that has its door open
../../datasets/OldStyles/style5/A man flying through the air while riding a snowboard.jpg,A man flying through the air while riding a snowboard
../../datasets/OldStyles/style5/A Range Rover vehicle being loaded from a helicopter behind it.jpg,A Range Rover vehicle being loaded from a helicopter behind it
../../datasets/OldStyles/style5/A happy skier holds out her arms at the top of a snowy mountain.jpg,A happy skier holds out her arms at the top of a snowy mountain
../../datasets/OldStyles/style5/a person sitting on a floor with a laptop.jpg,a person sitting on a floor with a laptop
"../../datasets/OldStyles/style5/An open living room, with a large screen tv.jpg","An open living room, with a large screen tv"
../../datasets/OldStyles/style5/a plate with a picture of a cat on it.jpg,a plate with a picture of a cat on it
../../datasets/OldStyles/style5/A woman is holding something for a dog to bite at.jpg,A woman is holding something for a dog to bite at
../../datasets/OldStyles/style5/A man smoking holding a sports item in his hand.jpg,A man smoking holding a sports item in his hand
../../datasets/OldStyles/style5/Here's a cute souvenir from the urban experience.jpg,Here's a cute souvenir from the urban experience
../../datasets/OldStyles/style5/A bunch of cars that are sitting together in the street.jpg,A bunch of cars that are sitting together in the street
../../datasets/OldStyles/style5/A cow is walking through the streets by vendors.jpg,A cow is walking through the streets by vendors
../../datasets/OldStyles/style5/A vehicle making a tight turn in an intersection.jpg,A vehicle making a tight turn in an intersection
../../datasets/OldStyles/style5/Statues of animals are spread across a room.jpg,Statues of animals are spread across a room
../../datasets/OldStyles/style5/A zebra walking beside a tree line in the grass.jpg,A zebra walking beside a tree line in the grass
../../datasets/OldStyles/style5/A sign shows the price of many bananas on display.jpg,A sign shows the price of many bananas on display
../../datasets/OldStyles/style5/A couple of signs and some cars on a street.jpg,A couple of signs and some cars on a street
../../datasets/OldStyles/style5/There is a man and a woman standing under an umbrella.jpg,There is a man and a woman standing under an umbrella
../../datasets/OldStyles/style5/A woman and boy riding a paddle board in a waterway.jpg,A woman and boy riding a paddle board in a waterway
../../datasets/OldStyles/style5/A large passenger jet on top of an airport runway.jpg,A large passenger jet on top of an airport runway
../../datasets/OldStyles/style5/A baby elephant is snuggling near his mother.jpg,A baby elephant is snuggling near his mother
../../datasets/OldStyles/style5/A boat that is sitting in the water near a wall.jpg,A boat that is sitting in the water near a wall
../../datasets/OldStyles/style5/two people dressed in a dress and suit and tie posing for a photo.jpg,two people dressed in a dress and suit and tie posing for a photo
../../datasets/OldStyles/style5/A jet flying with a spacecraft on top followed by another jet.jpg,A jet flying with a spacecraft on top followed by another jet
../../datasets/OldStyles/style5/Two beds sitting inside of a hotel room next to a lamp.jpg,Two beds sitting inside of a hotel room next to a lamp
../../datasets/OldStyles/style5/A kid with a tie standing next to a speaker.jpg,A kid with a tie standing next to a speaker
../../datasets/OldStyles/style5/A sandwich cut in half on a plate with a pickle.jpg,A sandwich cut in half on a plate with a pickle
../../datasets/OldStyles/style5/Someone's shoe stuck to a stop sign in the city.jpg,Someone's shoe stuck to a stop sign in the city
../../datasets/OldStyles/style5/Two giraffes standing on grass near a rock pile.jpg,Two giraffes standing on grass near a rock pile
../../datasets/OldStyles/style5/A clock is installed on the side of an ornate building.jpg,A clock is installed on the side of an ornate building
../../datasets/OldStyles/style5/a house in a field and a table with plates of food on it.jpg,a house in a field and a table with plates of food on it
../../datasets/OldStyles/style5/A ball player is preparing to take a swing.jpg,A ball player is preparing to take a swing
../../datasets/OldStyles/style5/Several people standing around a table full of beer bottles.jpg,Several people standing around a table full of beer bottles
../../datasets/OldStyles/style5/A black and white photo of a poster or book cover.jpg,A black and white photo of a poster or book cover
../../datasets/OldStyles/style5/A red fire hydrant is next to a post with a small picture of a hydrant atop it.jpg,A red fire hydrant is next to a post with a small picture of a hydrant atop it
../../datasets/OldStyles/style5/Six people are paddle boarding in the ocean.jpg,Six people are paddle boarding in the ocean
../../datasets/OldStyles/style5/a plate of food is on a counter top.jpg,a plate of food is on a counter top
../../datasets/OldStyles/style5/Workers and customers standing inside of a fruit and produce market.jpg,Workers and customers standing inside of a fruit and produce market
../../datasets/OldStyles/style5/A young man holds his cell phone while lying on the grass.jpg,A young man holds his cell phone while lying on the grass
../../datasets/OldStyles/style5/There women sitting on a couch playing a game with Nintendo Wii controllers.jpg,There women sitting on a couch playing a game with Nintendo Wii controllers
../../datasets/OldStyles/style5/A pitcher is winding up to pitch a baseball.jpg,A pitcher is winding up to pitch a baseball
../../datasets/OldStyles/style5/a glass a rope and a pair of scissors.jpg,a glass a rope and a pair of scissors
../../datasets/OldStyles/style5/An orange motorcycle that is parked in the street.jpg,An orange motorcycle that is parked in the street
../../datasets/OldStyles/style5/A double decker metro bus stopped at a covered bus stop loading passengers.jpg,A double decker metro bus stopped at a covered bus stop loading passengers
../../datasets/OldStyles/style5/A Disney hotel bed with towels folded into an elephant wearing sunglasses.jpg,A Disney hotel bed with towels folded into an elephant wearing sunglasses
../../datasets/OldStyles/style5/A few wooden sailing ships on display outdoors.jpg,A few wooden sailing ships on display outdoors
../../datasets/OldStyles/style5/Several people playing frisbee indoors on a basketball court.jpg,Several people playing frisbee indoors on a basketball court
../../datasets/OldStyles/style5/A closed umbrella is strapped to the middle bar of a bicycle.jpg,A closed umbrella is strapped to the middle bar of a bicycle
../../datasets/OldStyles/style5/An apple lap top on top of suit cases.jpg,An apple lap top on top of suit cases
../../datasets/OldStyles/style5/a close up of a truck driving on a road.jpg,a close up of a truck driving on a road
../../datasets/OldStyles/style5/Smiling man with chefs outfit in a kitchen holding towel.jpg,Smiling man with chefs outfit in a kitchen holding towel
../../datasets/OldStyles/style5/Black cow stands and look towards the camera.jpg,Black cow stands and look towards the camera
../../datasets/OldStyles/style5/A herd of elephants stands in an enclosure.jpg,A herd of elephants stands in an enclosure
../../datasets/OldStyles/style5/The young couple is sitting on the bench.jpg,The young couple is sitting on the bench
../../datasets/OldStyles/style5/towels are folding into the shapes of elephants and swans on bed.jpg,towels are folding into the shapes of elephants and swans on bed
../../datasets/OldStyles/style5/There are four mice set up in front of a computer.jpg,There are four mice set up in front of a computer
../../datasets/OldStyles/style5/Two giraffe walk on the road near a tree at daybreak.jpg,Two giraffe walk on the road near a tree at daybreak
../../datasets/OldStyles/style5/A green bus near a curb in front of a brick building.jpg,A green bus near a curb in front of a brick building
../../datasets/OldStyles/style5/A group of baseball players standing on top of a field.jpg,A group of baseball players standing on top of a field
../../datasets/OldStyles/style5/A man holding a baseball bat at a home plate.jpg,A man holding a baseball bat at a home plate
../../datasets/OldStyles/style5/A man plays frisbee in a small field.jpg,A man plays frisbee in a small field
../../datasets/OldStyles/style5/A horse grazing on a countryside near a ranch house.jpg,A horse grazing on a countryside near a ranch house
../../datasets/OldStyles/style5/Zebras and elephants checking out a passenger van.jpg,Zebras and elephants checking out a passenger van
"../../datasets/OldStyles/style5/A small bathroom with a toilet, sink, and red and yellow shower curtain.jpg","A small bathroom with a toilet, sink, and red and yellow shower curtain"
../../datasets/OldStyles/style5/Large group of traffic lights on a green tree post.jpg,Large group of traffic lights on a green tree post
../../datasets/OldStyles/style5/A man sitting at a table working on his open laptop.jpg,A man sitting at a table working on his open laptop
../../datasets/OldStyles/style5/There are street lights and traffic signals but no people or cars.jpg,There are street lights and traffic signals but no people or cars
../../datasets/OldStyles/style5/A skateboarder performing a trick in midair in near desolate parking lot.jpg,A skateboarder performing a trick in midair in near desolate parking lot
../../datasets/OldStyles/style5/a white sink and shower in a bathroom.jpg,a white sink and shower in a bathroom
../../datasets/OldStyles/style5/A small bathroom holds a circular mirror and light fixture.jpg,A small bathroom holds a circular mirror and light fixture
../../datasets/OldStyles/style5/A picture of a salad in a bowl on a table.jpg,A picture of a salad in a bowl on a table
../../datasets/OldStyles/style5/Several people are outside in a grassy field.jpg,Several people are outside in a grassy field
../../datasets/OldStyles/style5/A man riding a bike past a number of cars on a busy city street with buses and traffic light.jpg,A man riding a bike past a number of cars on a busy city street with buses and traffic light
../../datasets/OldStyles/style5/Two women who are standing near each other.jpg,Two women who are standing near each other
../../datasets/OldStyles/style5/The man in stripes holds onto the plate of food as he poses for a picture.jpg,The man in stripes holds onto the plate of food as he poses for a picture
../../datasets/OldStyles/style5/A baseball player holding a bat during a baseball game.jpg,A baseball player holding a bat during a baseball game
../../datasets/OldStyles/style5/Various blue tables with closed yellow umbrellas on beach.jpg,Various blue tables with closed yellow umbrellas on beach
../../datasets/OldStyles/style5/A red and grey train in train station during day.jpg,A red and grey train in train station during day
../../datasets/OldStyles/style5/A man and a woman pose beside a gold fire hydrant.jpg,A man and a woman pose beside a gold fire hydrant
../../datasets/OldStyles/style5/A man playing frisbee in a swimming pool.jpg,A man playing frisbee in a swimming pool
../../datasets/OldStyles/style5/Two vintage red double decker busses on a road.jpg,Two vintage red double decker busses on a road
