image,text
../../datasets/Styles/style2/A train coming down the tracks through a town.jpg,A train coming down the tracks through a town
../../datasets/Styles/style2/woman in jeans in kitchen taking the milk out.jpg,woman in jeans in kitchen taking the milk out
../../datasets/Styles/style2/A man skiing downhill in the snow.jpg,A man skiing downhill in the snow
../../datasets/Styles/style2/A young girl on the beach flying a kite.jpg,A young girl on the beach flying a kite
../../datasets/Styles/style2/Two slices of pepperoni and cheese pizza on a table.jpg,Two slices of pepperoni and cheese pizza on a table
../../datasets/Styles/style2/Man on a surfboard under a large wave.jpg,Man on a surfboard under a large wave
../../datasets/Styles/style2/Someone is having a meal complete with vegetables and a meat.jpg,Someone is having a meal complete with vegetables and a meat
../../datasets/Styles/style2/A mysterious man is about to eat a banana.jpg,A mysterious man is about to eat a banana
../../datasets/Styles/style2/A woman in grey and white sweater holding a ceramic carrot.jpg,A woman in grey and white sweater holding a ceramic carrot
../../datasets/Styles/style2/A black and white sheep is sitting in the bushes.jpg,A black and white sheep is sitting in the bushes
../../datasets/Styles/style2/A man riding on the back of a parked motorcycle.jpg,A man riding on the back of a parked motorcycle
../../datasets/Styles/style2/some jets and airplanes and small trucks and a building.jpg,some jets and airplanes and small trucks and a building
../../datasets/Styles/style2/A view of the street at a red light in a city.jpg,A view of the street at a red light in a city
../../datasets/Styles/style2/A red double decker bus parked in front of a tall building.jpg,A red double decker bus parked in front of a tall building
../../datasets/Styles/style2/A man holding up two cells phones to the sides of his face.jpg,A man holding up two cells phones to the sides of his face
../../datasets/Styles/style2/Poised to slice into an iced multi-layer cake.jpg,Poised to slice into an iced multi-layer cake
../../datasets/Styles/style2/A person on a snowboard catching some air over a hill.jpg,A person on a snowboard catching some air over a hill
../../datasets/Styles/style2/A brown and white animal standing next to a marina.jpg,A brown and white animal standing next to a marina
../../datasets/Styles/style2/People line up to get pizza and fruit from a buffet.jpg,People line up to get pizza and fruit from a buffet
../../datasets/Styles/style2/FIVE HORSES AND POLICE MEN LINED ON IN A ROW.jpg,FIVE HORSES AND POLICE MEN LINED ON IN A ROW
../../datasets/Styles/style2/Digital billboard outside a modern suburban high school.jpg,Digital billboard outside a modern suburban high school
../../datasets/Styles/style2/Three people with back packs and dogs in the woods.jpg,Three people with back packs and dogs in the woods
../../datasets/Styles/style2/A lovely fall flower arrangement sits in an unusual vase.jpg,A lovely fall flower arrangement sits in an unusual vase
../../datasets/Styles/style2/A BEAGLE IS ENJOYING HIMSELF LOOKING OUT THE WINDSHIELD.jpg,A BEAGLE IS ENJOYING HIMSELF LOOKING OUT THE WINDSHIELD
../../datasets/Styles/style2/Two zebra standing next to each other on a dry grass field.jpg,Two zebra standing next to each other on a dry grass field
../../datasets/Styles/style2/a bed with an open laptop on top of the bed.jpg,a bed with an open laptop on top of the bed
../../datasets/Styles/style2/A flat screen television mounted on a wall.jpg,A flat screen television mounted on a wall
../../datasets/Styles/style2/a person in all red skiing down a slope.jpg,a person in all red skiing down a slope
../../datasets/Styles/style2/Multiple baskets full of various different vegetables on crates.jpg,Multiple baskets full of various different vegetables on crates
../../datasets/Styles/style2/Three giraffes are standing in a brushy field.jpg,Three giraffes are standing in a brushy field
"../../datasets/Styles/style2/The man is dressed in a suit, tie, and hat for a photo.jpg","The man is dressed in a suit, tie, and hat for a photo"
../../datasets/Styles/style2/a man and his dog are floating on a surfboard in the water.jpg,a man and his dog are floating on a surfboard in the water
../../datasets/Styles/style2/a double deckered bus on a city street.jpg,a double deckered bus on a city street
../../datasets/Styles/style2/Red colored animals displayed near plants in indoor setting.jpg,Red colored animals displayed near plants in indoor setting
../../datasets/Styles/style2/a shower view of a curtain and sink  with a tiled wall.jpg,a shower view of a curtain and sink  with a tiled wall
../../datasets/Styles/style2/A couple of young girls are behind the gate observing a black cow.jpg,A couple of young girls are behind the gate observing a black cow
../../datasets/Styles/style2/A brown dog chewing on an orange toy.jpg,A brown dog chewing on an orange toy
../../datasets/Styles/style2/A pair of zebras standing around in a pen.jpg,A pair of zebras standing around in a pen
../../datasets/Styles/style2/A man jumps onto the saddle of a moving horse.jpg,A man jumps onto the saddle of a moving horse
../../datasets/Styles/style2/A double decker bus is next to the sidewalk.jpg,A double decker bus is next to the sidewalk
../../datasets/Styles/style2/A little boy flies a kite in the green meadow beyond a town.jpg,A little boy flies a kite in the green meadow beyond a town
../../datasets/Styles/style2/A stop sign sitting near a church with some Mountains in the background.jpg,A stop sign sitting near a church with some Mountains in the background
../../datasets/Styles/style2/A toilet with a bottle and some trash in it.jpg,A toilet with a bottle and some trash in it
../../datasets/Styles/style2/A bird looking to its right on a tree branch.jpg,A bird looking to its right on a tree branch
../../datasets/Styles/style2/A white toilet mounted against a bathroom wall.jpg,A white toilet mounted against a bathroom wall
../../datasets/Styles/style2/A young girl is batting on a field.jpg,A young girl is batting on a field
../../datasets/Styles/style2/An orange and white cat and beaver looking at an ear of corn.jpg,An orange and white cat and beaver looking at an ear of corn
../../datasets/Styles/style2/a old bed and water heater in a room.jpg,a old bed and water heater in a room
../../datasets/Styles/style2/a white train is coming down some tracks.jpg,a white train is coming down some tracks
../../datasets/Styles/style2/very bright colored looking market with a bunch of fruit.jpg,very bright colored looking market with a bunch of fruit
../../datasets/Styles/style2/A skiier is pictured in well-trampled snow with a nearby large snowball.jpg,A skiier is pictured in well-trampled snow with a nearby large snowball
"../../datasets/Styles/style2/A man about to bump fists with another man, both baseball players.jpg","A man about to bump fists with another man, both baseball players"
../../datasets/Styles/style2/A happy girl riding a boogie board all the way to the beach.jpg,A happy girl riding a boogie board all the way to the beach
../../datasets/Styles/style2/a game of ultimate frisbee in college level.jpg,a game of ultimate frisbee in college level
../../datasets/Styles/style2/Scissors sitting next to white sticks and a blanket.jpg,Scissors sitting next to white sticks and a blanket
../../datasets/Styles/style2/A blue train is on the train tracks near electric wires.jpg,A blue train is on the train tracks near electric wires
../../datasets/Styles/style2/Black and white photograph of multiple planes in dirt area.jpg,Black and white photograph of multiple planes in dirt area
../../datasets/Styles/style2/A bus is parked outside of a stadium awaiting passengers to board.jpg,A bus is parked outside of a stadium awaiting passengers to board
../../datasets/Styles/style2/an older man and two horses pulling a cart.jpg,an older man and two horses pulling a cart
../../datasets/Styles/style2/A boy and girl sitting on top of a skateboard.jpg,A boy and girl sitting on top of a skateboard
../../datasets/Styles/style2/Two people are reaching up for a white Frisbee.jpg,Two people are reaching up for a white Frisbee
../../datasets/Styles/style2/An industrial sized blender filling a jar.jpg,An industrial sized blender filling a jar
../../datasets/Styles/style2/A bird's eye view of a tennis match in a crowded stadium.jpg,A bird's eye view of a tennis match in a crowded stadium
../../datasets/Styles/style2/A person that is cooking some food in a store.jpg,A person that is cooking some food in a store
../../datasets/Styles/style2/a man on a skateboard rides on the inside wall of an empty swimming pool.jpg,a man on a skateboard rides on the inside wall of an empty swimming pool
../../datasets/Styles/style2/A baby elephant standing next to it's parents.jpg,A baby elephant standing next to it's parents
../../datasets/Styles/style2/The person has a cellphone in their hand that is off.jpg,The person has a cellphone in their hand that is off
../../datasets/Styles/style2/A fake fire hydrant on a plate next to a basket of toys.jpg,A fake fire hydrant on a plate next to a basket of toys
../../datasets/Styles/style2/An architectural clock in a historical building in Prague.jpg,An architectural clock in a historical building in Prague
../../datasets/Styles/style2/Small public bathroom with small white sinks with mirrors.jpg,Small public bathroom with small white sinks with mirrors
../../datasets/Styles/style2/a white red black and blue truck and a white house.jpg,a white red black and blue truck and a white house
../../datasets/Styles/style2/A young bear stands on a boulder in the brush.jpg,A young bear stands on a boulder in the brush
../../datasets/Styles/style2/A sleigh ride on a cold morning in Vermont.jpg,A sleigh ride on a cold morning in Vermont
../../datasets/Styles/style2/A man on a skate board going down hill through some cones.jpg,A man on a skate board going down hill through some cones
../../datasets/Styles/style2/A small white boat on the open water.jpg,A small white boat on the open water
../../datasets/Styles/style2/A cute cat sitting on a wooden park bench.jpg,A cute cat sitting on a wooden park bench
../../datasets/Styles/style2/Pencils are spilling out on a mouse pad.jpg,Pencils are spilling out on a mouse pad
../../datasets/Styles/style2/a long bus is parked outside of a car garage.jpg,a long bus is parked outside of a car garage
../../datasets/Styles/style2/A bathroom door is open and has writing on it.jpg,A bathroom door is open and has writing on it
../../datasets/Styles/style2/A bathroom has some neatly placed folded towels.jpg,A bathroom has some neatly placed folded towels
../../datasets/Styles/style2/A little girl and boy are sitting on the couch with two women watching a movie as the girl cups her mouth.jpg,A little girl and boy are sitting on the couch with two women watching a movie as the girl cups her mouth
../../datasets/Styles/style2/A man holding his bride as they cute their wedding cake.jpg,A man holding his bride as they cute their wedding cake
../../datasets/Styles/style2/Vehicles at roadway intersection on clear sunny day.jpg,Vehicles at roadway intersection on clear sunny day
../../datasets/Styles/style2/Four people are looking at two calves and a cat.jpg,Four people are looking at two calves and a cat
../../datasets/Styles/style2/A locomotive train on a track by the side of a body of water and hills in the distance.jpg,A locomotive train on a track by the side of a body of water and hills in the distance
../../datasets/Styles/style2/a cat with feet and a persons boots.jpg,a cat with feet and a persons boots
../../datasets/Styles/style2/a bird is standing on a green chair.jpg,a bird is standing on a green chair
../../datasets/Styles/style2/A group of people flying kites on a field.jpg,A group of people flying kites on a field
"../../datasets/Styles/style2/A man is leaping in the air, serving a tennis ball.jpg","A man is leaping in the air, serving a tennis ball"
../../datasets/Styles/style2/Tourists enjoying spirits at an underground brewery.jpg,Tourists enjoying spirits at an underground brewery
../../datasets/Styles/style2/A repair man is fixing the cabinet in the kitchen.jpg,A repair man is fixing the cabinet in the kitchen
../../datasets/Styles/style2/many people on some grass cars and kites.jpg,many people on some grass cars and kites
../../datasets/Styles/style2/a person sitting on a bench with their head crouched over.jpg,a person sitting on a bench with their head crouched over
../../datasets/Styles/style2/An elephant stands on its hind legs in front of spectators.jpg,An elephant stands on its hind legs in front of spectators
../../datasets/Styles/style2/a girl in a black dress laying on her bed and a black and white teddy bear.jpg,a girl in a black dress laying on her bed and a black and white teddy bear
../../datasets/Styles/style2/A kitchen has it's counter top lit up.jpg,A kitchen has it's counter top lit up
../../datasets/Styles/style2/The man is jumping into the air with a Frisbee near a house.jpg,The man is jumping into the air with a Frisbee near a house
../../datasets/Styles/style2/A baseball player prepares to hit a home run.jpg,A baseball player prepares to hit a home run
../../datasets/Styles/style2/Two chefs are standing in the kitchen smiling.jpg,Two chefs are standing in the kitchen smiling
../../datasets/Styles/style2/A Kitchen Aid blender is unplugged and on display.jpg,A Kitchen Aid blender is unplugged and on display
"../../datasets/Styles/style2/A room with a bed, table, microwave, small refrigerator and a nightstand with books.jpg","A room with a bed, table, microwave, small refrigerator and a nightstand with books"
../../datasets/Styles/style2/Used bottle of hair coloring in front of a mirror.jpg,Used bottle of hair coloring in front of a mirror
../../datasets/Styles/style2/Open savanna with a lone giraffe facing the camera.jpg,Open savanna with a lone giraffe facing the camera
../../datasets/Styles/style2/A train station with several people and parked trains.jpg,A train station with several people and parked trains
../../datasets/Styles/style2/A man holding a skateboard on a sidewalk.jpg,A man holding a skateboard on a sidewalk
../../datasets/Styles/style2/A group of three men sitting next to each other in a tent.jpg,A group of three men sitting next to each other in a tent
../../datasets/Styles/style2/A red plate has a desert with blueberries on it.jpg,A red plate has a desert with blueberries on it
../../datasets/Styles/style2/Small child with glasses holding up food to his face.jpg,Small child with glasses holding up food to his face
../../datasets/Styles/style2/A man sitting at a table using a laptop computer.jpg,A man sitting at a table using a laptop computer
../../datasets/Styles/style2/A person wearing two different shoes eating a piece of food.jpg,A person wearing two different shoes eating a piece of food
../../datasets/Styles/style2/A picture of an umbrella on the street.jpg,A picture of an umbrella on the street
../../datasets/Styles/style2/This is a man working on a construction site on a busy road.jpg,This is a man working on a construction site on a busy road
../../datasets/Styles/style2/an image of kids riding on their skateboards.jpg,an image of kids riding on their skateboards
../../datasets/Styles/style2/A group of men standing next to each other wearing face paint.jpg,A group of men standing next to each other wearing face paint
../../datasets/Styles/style2/A group of people standing on and around a white and black van.jpg,A group of people standing on and around a white and black van
../../datasets/Styles/style2/A little girl trying to brush a birds beak with a tooth brush.jpg,A little girl trying to brush a birds beak with a tooth brush
../../datasets/Styles/style2/a young boy reading a book about henry's  newspaper.jpg,a young boy reading a book about henry's  newspaper
../../datasets/Styles/style2/An adult brown horse standing next to two baby brown horses.jpg,An adult brown horse standing next to two baby brown horses
../../datasets/Styles/style2/A sandwich on top of a plate with juice.jpg,A sandwich on top of a plate with juice
../../datasets/Styles/style2/A very small girl flying a kite in a field.jpg,A very small girl flying a kite in a field
"../../datasets/Styles/style2/A pan topped with cheep pizza, a fork and a knife.jpg","A pan topped with cheep pizza, a fork and a knife"
../../datasets/Styles/style2/A man standing in front of a table holding a frisbee in his hands.jpg,A man standing in front of a table holding a frisbee in his hands
../../datasets/Styles/style2/The girl is using her right arm to hit the ball.jpg,The girl is using her right arm to hit the ball
../../datasets/Styles/style2/a bowl of vegetables with a spoon sitting on a table.jpg,a bowl of vegetables with a spoon sitting on a table
../../datasets/Styles/style2/A group of people walking in front of a fence as a bus goes by.jpg,A group of people walking in front of a fence as a bus goes by
../../datasets/Styles/style2/Two people on a ski lift ride above the buildings.jpg,Two people on a ski lift ride above the buildings
../../datasets/Styles/style2/Some of the Catholic School children are lined up in single file before the microphone.jpg,Some of the Catholic School children are lined up in single file before the microphone
../../datasets/Styles/style2/Someone in a car taking a picture of another car and an airplane.jpg,Someone in a car taking a picture of another car and an airplane
../../datasets/Styles/style2/A woman swings her tennis racket to hit the ball.jpg,A woman swings her tennis racket to hit the ball
../../datasets/Styles/style2/She is getting ready to fly that kite.jpg,She is getting ready to fly that kite
../../datasets/Styles/style2/Man sitting at desk in office with sandwich.jpg,Man sitting at desk in office with sandwich
../../datasets/Styles/style2/A family poses for a picture on the downhill ski slope.jpg,A family poses for a picture on the downhill ski slope
../../datasets/Styles/style2/A sign for a restaruant hangs from the wall.jpg,A sign for a restaruant hangs from the wall
../../datasets/Styles/style2/A man standing next to a  flying white frisbee.jpg,A man standing next to a  flying white frisbee
../../datasets/Styles/style2/A variety of desserts being displayed on some shelves.jpg,A variety of desserts being displayed on some shelves
../../datasets/Styles/style2/There are people standing outside that are holding umbrellas.jpg,There are people standing outside that are holding umbrellas
../../datasets/Styles/style2/a man holding a tennis racket playing inside a building.jpg,a man holding a tennis racket playing inside a building
../../datasets/Styles/style2/A person standing on the edge of a skateboard and riding two wheels.jpg,A person standing on the edge of a skateboard and riding two wheels
../../datasets/Styles/style2/A person is holding a cauliflower head in their hand.jpg,A person is holding a cauliflower head in their hand
../../datasets/Styles/style2/A dinner table with several different dishes on it.jpg,A dinner table with several different dishes on it
../../datasets/Styles/style2/a man doing a hand stand in the road while holding a skateboard.jpg,a man doing a hand stand in the road while holding a skateboard
../../datasets/Styles/style2/An empty passenger train with windows says summer wind.jpg,An empty passenger train with windows says summer wind
../../datasets/Styles/style2/a street sign sits atop of a pole.jpg,a street sign sits atop of a pole
../../datasets/Styles/style2/A little kid  that is holding a kite.jpg,A little kid  that is holding a kite
../../datasets/Styles/style2/A man blowing out candles on a cake.jpg,A man blowing out candles on a cake
../../datasets/Styles/style2/A baseball player for the Angels holding a bat and wearing a helmet.jpg,A baseball player for the Angels holding a bat and wearing a helmet
../../datasets/Styles/style2/Four zebra stand in a field of tall brown grass.jpg,Four zebra stand in a field of tall brown grass
../../datasets/Styles/style2/A woman grilling fruit on a dirt covered street.jpg,A woman grilling fruit on a dirt covered street
../../datasets/Styles/style2/Woman in a chair outside using a laptop.jpg,Woman in a chair outside using a laptop
../../datasets/Styles/style2/A group of street signs at the end of a vacant block.jpg,A group of street signs at the end of a vacant block
../../datasets/Styles/style2/A dog sitting in the grass looking up.jpg,A dog sitting in the grass looking up
../../datasets/Styles/style2/A bed with flowery blankets and pillow cases.jpg,A bed with flowery blankets and pillow cases
../../datasets/Styles/style2/One man drinking from a beer bottle and another from a flask.jpg,One man drinking from a beer bottle and another from a flask
../../datasets/Styles/style2/A blender sits on a table near two shot glasses.jpg,A blender sits on a table near two shot glasses
../../datasets/Styles/style2/Grey commuter train at platform of covered station.jpg,Grey commuter train at platform of covered station
../../datasets/Styles/style2/A warning sign on the side of the road.jpg,A warning sign on the side of the road
../../datasets/Styles/style2/Street sign in front of a house on Ramsay St.jpg,Street sign in front of a house on Ramsay St
../../datasets/Styles/style2/Lit-up bridge in a city at night over a street.jpg,Lit-up bridge in a city at night over a street
../../datasets/Styles/style2/A bunch of different cakes on a white plate.jpg,A bunch of different cakes on a white plate
../../datasets/Styles/style2/two little goats laying down beside each other.jpg,two little goats laying down beside each other
"../../datasets/Styles/style2/VEGETABLE AND FRUIT INCLUDE BANANAS, CARROTS, KIWI, AND SQUASH.jpg","VEGETABLE AND FRUIT INCLUDE BANANAS, CARROTS, KIWI, AND SQUASH"
../../datasets/Styles/style2/A display in front of a store filled with fruits.jpg,A display in front of a store filled with fruits
"../../datasets/Styles/style2/A group of young men preparing to play tennis, one wearing an animal suit.jpg","A group of young men preparing to play tennis, one wearing an animal suit"
../../datasets/Styles/style2/Man on a tennis court holding tennis racket and ball.jpg,Man on a tennis court holding tennis racket and ball
../../datasets/Styles/style2/an adult jumping in a bed with sheets.jpg,an adult jumping in a bed with sheets
../../datasets/Styles/style2/A holiday display with ornaments ans stuffed animals.jpg,A holiday display with ornaments ans stuffed animals
../../datasets/Styles/style2/A red city bus making a turn on the street.jpg,A red city bus making a turn on the street
../../datasets/Styles/style2/An intersection with cars driving down a street.jpg,An intersection with cars driving down a street
../../datasets/Styles/style2/A professional baseball player awaiting a pitch at home plate.jpg,A professional baseball player awaiting a pitch at home plate
../../datasets/Styles/style2/A man speaking at a podium in a conference room.jpg,A man speaking at a podium in a conference room
../../datasets/Styles/style2/A man holding a brown teddy bear in his right hand.jpg,A man holding a brown teddy bear in his right hand
../../datasets/Styles/style2/A small bird is on the street by the curb.jpg,A small bird is on the street by the curb
../../datasets/Styles/style2/A suite case that has a large quantity of glasses in it.jpg,A suite case that has a large quantity of glasses in it
../../datasets/Styles/style2/A fire hydrant is next to a no dogs sign.jpg,A fire hydrant is next to a no dogs sign
../../datasets/Styles/style2/A beautiful blond woman swinging a tennis racquet at a tennis ball.jpg,A beautiful blond woman swinging a tennis racquet at a tennis ball
../../datasets/Styles/style2/A cat standing next to a person lying on a bed.jpg,A cat standing next to a person lying on a bed
../../datasets/Styles/style2/A group of various items that are on a counter.jpg,A group of various items that are on a counter
../../datasets/Styles/style2/There is a very large stop sign on the corner of this street.jpg,There is a very large stop sign on the corner of this street
../../datasets/Styles/style2/A man with goatee holding a baby in a theater.jpg,A man with goatee holding a baby in a theater
../../datasets/Styles/style2/A woman holding up a cell phone in front of her face.jpg,A woman holding up a cell phone in front of her face
../../datasets/Styles/style2/Two road flaggers one holding a stop sign.jpg,Two road flaggers one holding a stop sign
../../datasets/Styles/style2/a pitcher clearing the mound getting ready to play.jpg,a pitcher clearing the mound getting ready to play
../../datasets/Styles/style2/A group of people crammed onto a motorcycle on a road.jpg,A group of people crammed onto a motorcycle on a road
../../datasets/Styles/style2/A Boise cargo train on the train tracks.jpg,A Boise cargo train on the train tracks
../../datasets/Styles/style2/A chubby young man holding a yellow disc.jpg,A chubby young man holding a yellow disc
../../datasets/Styles/style2/there are two giraffes that are embracing together on a field.jpg,there are two giraffes that are embracing together on a field
../../datasets/Styles/style2/A man taking pictures of an elephant walking in a zoo.jpg,A man taking pictures of an elephant walking in a zoo
../../datasets/Styles/style2/A young woman holding a tennis racquet on a tennis court.jpg,A young woman holding a tennis racquet on a tennis court
../../datasets/Styles/style2/a group of giraffes walk along a path in the safari.jpg,a group of giraffes walk along a path in the safari
../../datasets/Styles/style2/A bowl of fruit and foods on top of a wooden table.jpg,A bowl of fruit and foods on top of a wooden table
