image,text
../../datasets/Styles/style2/Two birds perch on a rail near a plant.jpg,Two birds perch on a rail near a plant
../../datasets/Styles/style2/An elephant with polka dotted ears eating grass.jpg,An elephant with polka dotted ears eating grass
../../datasets/Styles/style2/A man and a young child sitting at a desk on a computer.jpg,A man and a young child sitting at a desk on a computer
../../datasets/Styles/style2/A long colorful train traveling down train tracks.jpg,A long colorful train traveling down train tracks
../../datasets/Styles/style2/The remote controls are placed on the side of the television.jpg,The remote controls are placed on the side of the television
../../datasets/Styles/style2/kitchen with large sink and washed dishes drying.jpg,kitchen with large sink and washed dishes drying
../../datasets/Styles/style2/A photo looking down an alley at a clock tower.jpg,A photo looking down an alley at a clock tower
../../datasets/Styles/style2/This platter of food includes a variety of foods.jpg,This platter of food includes a variety of foods
../../datasets/Styles/style2/A man on white surfboard paddling down a river.jpg,A man on white surfboard paddling down a river
"../../datasets/Styles/style2/A dish of salmon with pesto, with brocolli on the side.jpg","A dish of salmon with pesto, with brocolli on the side"
../../datasets/Styles/style2/black and white photo of a bus and some kids.jpg,black and white photo of a bus and some kids
../../datasets/Styles/style2/A baby is smiling with a teddy bear.jpg,A baby is smiling with a teddy bear
../../datasets/Styles/style2/Two guys prepare to take a canoe out on the ocean.jpg,Two guys prepare to take a canoe out on the ocean
../../datasets/Styles/style2/A large roman numeral clock is lit up in the dark.jpg,A large roman numeral clock is lit up in the dark
../../datasets/Styles/style2/An old rusted stop sign sitting in some bushes.jpg,An old rusted stop sign sitting in some bushes
../../datasets/Styles/style2/A white truck is pulling a trailer while a man in black walks by.jpg,A white truck is pulling a trailer while a man in black walks by
../../datasets/Styles/style2/A banana split sits in a glass bowl on a table.jpg,A banana split sits in a glass bowl on a table
../../datasets/Styles/style2/A person prepares to swing at a tennis ball.jpg,A person prepares to swing at a tennis ball
../../datasets/Styles/style2/A large fishing boat is traveling on the water.jpg,A large fishing boat is traveling on the water
../../datasets/Styles/style2/A man with a para sail chute flying it in the air.jpg,A man with a para sail chute flying it in the air
../../datasets/Styles/style2/Three people standing together with cell phones in their hands.jpg,Three people standing together with cell phones in their hands
"../../datasets/Styles/style2/A person wearing black and white, catching a soccer ball.jpg","A person wearing black and white, catching a soccer ball"
../../datasets/Styles/style2/Light green and white painted fire hydrant with people walking in background.jpg,Light green and white painted fire hydrant with people walking in background
../../datasets/Styles/style2/A small knife sites outside a jacket pocket.jpg,A small knife sites outside a jacket pocket
../../datasets/Styles/style2/THREE ZEBRAS WALKING TOWARDS THE RIVER FOR A DRINK.jpg,THREE ZEBRAS WALKING TOWARDS THE RIVER FOR A DRINK
../../datasets/Styles/style2/An outdoor bed and chair sit under a canopy.jpg,An outdoor bed and chair sit under a canopy
../../datasets/Styles/style2/A airplane coming in a for a landing on the water.jpg,A airplane coming in a for a landing on the water
../../datasets/Styles/style2/Snow covered mountains with people going skiing.jpg,Snow covered mountains with people going skiing
../../datasets/Styles/style2/a baby boy wearing blue is sleeping and holding his stuffed animal.jpg,a baby boy wearing blue is sleeping and holding his stuffed animal
../../datasets/Styles/style2/A construction truck carrying a large crane on it.jpg,A construction truck carrying a large crane on it
../../datasets/Styles/style2/A truck with a guitar on the side sits in a sidewalk.jpg,A truck with a guitar on the side sits in a sidewalk
../../datasets/Styles/style2/Three kids posing with each other next to a stop sign.jpg,Three kids posing with each other next to a stop sign
"../../datasets/Styles/style2/A plate has chicken, potatoes and toast on it.jpg","A plate has chicken, potatoes and toast on it"
../../datasets/Styles/style2/There are track in the snow from a skier.jpg,There are track in the snow from a skier
../../datasets/Styles/style2/A man standing in front of a TV playing a video game.jpg,A man standing in front of a TV playing a video game
../../datasets/Styles/style2/A miniature basket of fruit is displayed by a penny.jpg,A miniature basket of fruit is displayed by a penny
../../datasets/Styles/style2/dark colored cows standing close to a fence.jpg,dark colored cows standing close to a fence
../../datasets/Styles/style2/A teen in a pinny prepares to throw a Frisbee.jpg,A teen in a pinny prepares to throw a Frisbee
../../datasets/Styles/style2/A man reaches up with a tennis racket.jpg,A man reaches up with a tennis racket
../../datasets/Styles/style2/Several giraffes are standing on the short grass.jpg,Several giraffes are standing on the short grass
../../datasets/Styles/style2/This fork is cutting food on a plate.jpg,This fork is cutting food on a plate
../../datasets/Styles/style2/A red stop sign sitting next to a parking lot.jpg,A red stop sign sitting next to a parking lot
../../datasets/Styles/style2/There is a skateboarder jumping over another person.jpg,There is a skateboarder jumping over another person
../../datasets/Styles/style2/A flock of sheep are walking down the road.jpg,A flock of sheep are walking down the road
../../datasets/Styles/style2/A man sitting on a bench next to a brown cow with horns.jpg,A man sitting on a bench next to a brown cow with horns
../../datasets/Styles/style2/This photo shows several cell phones in a group.jpg,This photo shows several cell phones in a group
../../datasets/Styles/style2/A large group of people holding up stuffed animals.jpg,A large group of people holding up stuffed animals
../../datasets/Styles/style2/Herd of animals standing together by the water.jpg,Herd of animals standing together by the water
../../datasets/Styles/style2/A horse that is pulling a cart in the street.jpg,A horse that is pulling a cart in the street
../../datasets/Styles/style2/THERE IS A LINE OF A LOT OF MOTORCYCLES ON THE STREET.jpg,THERE IS A LINE OF A LOT OF MOTORCYCLES ON THE STREET
../../datasets/Styles/style2/a  surfer doing a good job of riding the wave.jpg,a  surfer doing a good job of riding the wave
../../datasets/Styles/style2/A young man jumps on his skateboard.jpg,A young man jumps on his skateboard
../../datasets/Styles/style2/An airplane playing over a field of bushes.jpg,An airplane playing over a field of bushes
../../datasets/Styles/style2/A large pizza covered in lots of cheese.jpg,A large pizza covered in lots of cheese
../../datasets/Styles/style2/A yellow bus driving through a river filled with passengers.jpg,A yellow bus driving through a river filled with passengers
../../datasets/Styles/style2/A red umbrella on the ground in front of brick building.jpg,A red umbrella on the ground in front of brick building
../../datasets/Styles/style2/a white and brown horse walking around a fenced off area.jpg,a white and brown horse walking around a fenced off area
../../datasets/Styles/style2/A plate with different types of fruit on it.jpg,A plate with different types of fruit on it
../../datasets/Styles/style2/A young boy standing on top of a sandy beach.jpg,A young boy standing on top of a sandy beach
../../datasets/Styles/style2/A large US Air Force plane is sitting in a field of mulch for display.jpg,A large US Air Force plane is sitting in a field of mulch for display
../../datasets/Styles/style2/A person is removing a dish of baked food from an oven.jpg,A person is removing a dish of baked food from an oven
../../datasets/Styles/style2/A man with a black and red life jacket water skiing.jpg,A man with a black and red life jacket water skiing
"../../datasets/Styles/style2/A polar bear lies in snow, legs spread open.jpg","A polar bear lies in snow, legs spread open"
../../datasets/Styles/style2/There are several desserts on top of a small table.jpg,There are several desserts on top of a small table
../../datasets/Styles/style2/A woman sitting at a white table with a pastry.jpg,A woman sitting at a white table with a pastry
../../datasets/Styles/style2/A display of many stuffed animals and bears.jpg,A display of many stuffed animals and bears
../../datasets/Styles/style2/A group of elephants are walking away from water.jpg,A group of elephants are walking away from water
../../datasets/Styles/style2/Person riding on bike against oncoming truck traffic.jpg,Person riding on bike against oncoming truck traffic
../../datasets/Styles/style2/A group of people on a  ski slope at night together.jpg,A group of people on a  ski slope at night together
"../../datasets/Styles/style2/Two people wearing skis, starting down a ski slope.jpg","Two people wearing skis, starting down a ski slope"
"../../datasets/Styles/style2/A rustic, outdoor oven surrounded by pots and bowls.jpg","A rustic, outdoor oven surrounded by pots and bowls"
../../datasets/Styles/style2/four people in animal costumes standing with suitcases.jpg,four people in animal costumes standing with suitcases
../../datasets/Styles/style2/Up close photo of professionally dressed man outdoors.jpg,Up close photo of professionally dressed man outdoors
../../datasets/Styles/style2/A lamb that is eating from the grass.jpg,A lamb that is eating from the grass
../../datasets/Styles/style2/Group of old women sitting at a restaurant dinner table together.jpg,Group of old women sitting at a restaurant dinner table together
../../datasets/Styles/style2/A couple of remote controls on a couch arm.jpg,A couple of remote controls on a couch arm
../../datasets/Styles/style2/People looking at a baby giraffe in the zoo.jpg,People looking at a baby giraffe in the zoo
../../datasets/Styles/style2/TRAIN ON TRACKS AT NIGHT WITH LIGHTS ON.jpg,TRAIN ON TRACKS AT NIGHT WITH LIGHTS ON
../../datasets/Styles/style2/A man camping with two dogs eating a meal.jpg,A man camping with two dogs eating a meal
../../datasets/Styles/style2/A purple skateboard is sitting in the middle of a dirty bus.jpg,A purple skateboard is sitting in the middle of a dirty bus
"../../datasets/Styles/style2/Two people are standing outside next to a dog, one is holding his hand in his pocket.jpg","Two people are standing outside next to a dog, one is holding his hand in his pocket"
../../datasets/Styles/style2/A woman standing outside a car on a busy street.jpg,A woman standing outside a car on a busy street
../../datasets/Styles/style2/An individual poses for a picture beside a bright window.jpg,An individual poses for a picture beside a bright window
../../datasets/Styles/style2/People flying kites on the national mall in front of the United States capitol building.jpg,People flying kites on the national mall in front of the United States capitol building
../../datasets/Styles/style2/A blue train pulling into a station next to a platform.jpg,A blue train pulling into a station next to a platform
../../datasets/Styles/style2/A color opposed photo of a desktop computer.jpg,A color opposed photo of a desktop computer
../../datasets/Styles/style2/A busy street show people crossing the sidewalk.jpg,A busy street show people crossing the sidewalk
../../datasets/Styles/style2/A small elephant stands in a dirt field by some trees.jpg,A small elephant stands in a dirt field by some trees
../../datasets/Styles/style2/a big bear runs through a wooded area.jpg,a big bear runs through a wooded area
../../datasets/Styles/style2/Workers standing in front of the the fuselage of an airplane.jpg,Workers standing in front of the the fuselage of an airplane
../../datasets/Styles/style2/Several white and black vases of the same style but different sizes.jpg,Several white and black vases of the same style but different sizes
../../datasets/Styles/style2/a book by jon katz is titled a good dog.jpg,a book by jon katz is titled a good dog
../../datasets/Styles/style2/Two large cows and one small cow standing in a field.jpg,Two large cows and one small cow standing in a field
../../datasets/Styles/style2/a glass plate with some hot dogs and corn on it.jpg,a glass plate with some hot dogs and corn on it
../../datasets/Styles/style2/A dog walking in a field with a Frisbee.jpg,A dog walking in a field with a Frisbee
../../datasets/Styles/style2/A man eats in front of a stop sign marked with graffiti.jpg,A man eats in front of a stop sign marked with graffiti
../../datasets/Styles/style2/A basic bedroom with a desk and small bed.jpg,A basic bedroom with a desk and small bed
../../datasets/Styles/style2/A man and a woman in a park start at an object in the distance.jpg,A man and a woman in a park start at an object in the distance
../../datasets/Styles/style2/A stone house sitting next to a leafy green tree.jpg,A stone house sitting next to a leafy green tree
../../datasets/Styles/style2/A skier skiing around poles set up on a ski course.jpg,A skier skiing around poles set up on a ski course
../../datasets/Styles/style2/A pile of TVs sitting next to a brick building.jpg,A pile of TVs sitting next to a brick building
../../datasets/Styles/style2/A giraffe rubbing it's nose on a tree trunk.jpg,A giraffe rubbing it's nose on a tree trunk
../../datasets/Styles/style2/a moped sitting in front of a store with lettuce next to it.jpg,a moped sitting in front of a store with lettuce next to it
../../datasets/Styles/style2/A blue and gold balcony with a gold clock and flag.jpg,A blue and gold balcony with a gold clock and flag
../../datasets/Styles/style2/Two little boys on a beach with a ball.jpg,Two little boys on a beach with a ball
../../datasets/Styles/style2/there is a giraffe by itself in a zoo or conservation.jpg,there is a giraffe by itself in a zoo or conservation
../../datasets/Styles/style2/Boy holding a tennis racket while aiming at a tennis ball.jpg,Boy holding a tennis racket while aiming at a tennis ball
../../datasets/Styles/style2/A person wearing red pants and goggles while riding a ski.jpg,A person wearing red pants and goggles while riding a ski
../../datasets/Styles/style2/A MAN IS ON THE BIKE WITH A USA FLAG.jpg,A MAN IS ON THE BIKE WITH A USA FLAG
../../datasets/Styles/style2/A man holding a woman on top of his lap.jpg,A man holding a woman on top of his lap
../../datasets/Styles/style2/A snowy hill with people skiing and some on a tram going to ski.jpg,A snowy hill with people skiing and some on a tram going to ski
../../datasets/Styles/style2/A couch and furniture in a small room.jpg,A couch and furniture in a small room
../../datasets/Styles/style2/The girl is standing up playing a video game.jpg,The girl is standing up playing a video game
"../../datasets/Styles/style2/Two giraffes walking in the grass, towards trees.jpg","Two giraffes walking in the grass, towards trees"
../../datasets/Styles/style2/Two women standing by a bottle lined counter.jpg,Two women standing by a bottle lined counter
../../datasets/Styles/style2/Stuffed Picachu and monkey along with a glass bottle.jpg,Stuffed Picachu and monkey along with a glass bottle
../../datasets/Styles/style2/A banana plant in a garden with a bunch of bananas.jpg,A banana plant in a garden with a bunch of bananas
../../datasets/Styles/style2/busy city  showing a big blue moving truck with graffiti  on it next to a  white van.jpg,busy city  showing a big blue moving truck with graffiti  on it next to a  white van
../../datasets/Styles/style2/A floral arrangement on the sidewalk next a train and railroad tracks.jpg,A floral arrangement on the sidewalk next a train and railroad tracks
../../datasets/Styles/style2/A sink with a black kitty sitting in it.jpg,A sink with a black kitty sitting in it
../../datasets/Styles/style2/A man drives a horse drawn cart down a cobblestone street.jpg,A man drives a horse drawn cart down a cobblestone street
../../datasets/Styles/style2/A bicycle that is being slowly covered over by some vines.jpg,A bicycle that is being slowly covered over by some vines
"../../datasets/Styles/style2/A Kitten hiding behind a computer, reaching around to touch the screen.jpg","A Kitten hiding behind a computer, reaching around to touch the screen"
../../datasets/Styles/style2/A herd of cattle grazing on a lush green field.jpg,A herd of cattle grazing on a lush green field
../../datasets/Styles/style2/A couple of men looking at something on a tablet.jpg,A couple of men looking at something on a tablet
../../datasets/Styles/style2/Young blond woman with beige hat and brown trim eating a large slice of pizza.jpg,Young blond woman with beige hat and brown trim eating a large slice of pizza
../../datasets/Styles/style2/A building that has a large tower that is lit up.jpg,A building that has a large tower that is lit up
../../datasets/Styles/style2/A crowd of people standing around a luggage carousel.jpg,A crowd of people standing around a luggage carousel
../../datasets/Styles/style2/A herd of elephants standing next to a forest.jpg,A herd of elephants standing next to a forest
../../datasets/Styles/style2/A very big cab over semi with a long trailer for hauling big loads.jpg,A very big cab over semi with a long trailer for hauling big loads
../../datasets/Styles/style2/A little girl watching a kite fly in the air.jpg,A little girl watching a kite fly in the air
../../datasets/Styles/style2/a person standing on a tennis court holding a tennis racket.jpg,a person standing on a tennis court holding a tennis racket
../../datasets/Styles/style2/There a man and woman standing on the beach.jpg,There a man and woman standing on the beach
../../datasets/Styles/style2/A road is closed off via signage and cones for extra protection.jpg,A road is closed off via signage and cones for extra protection
../../datasets/Styles/style2/An ugly ass room filled with shit atuff.jpg,An ugly ass room filled with shit atuff
../../datasets/Styles/style2/A dog is sitting on an ottoman in the living room.jpg,A dog is sitting on an ottoman in the living room
../../datasets/Styles/style2/a professional tennis player on a tennis court playing tennis.jpg,a professional tennis player on a tennis court playing tennis
../../datasets/Styles/style2/A person riding a skateboard on top of cement.jpg,A person riding a skateboard on top of cement
../../datasets/Styles/style2/Some military men watching another cut a cake with a sword.jpg,Some military men watching another cut a cake with a sword
../../datasets/Styles/style2/A laptop on a table plugged into the television above.jpg,A laptop on a table plugged into the television above
../../datasets/Styles/style2/A view of a hotel room with the light shining on the TV.jpg,A view of a hotel room with the light shining on the TV
../../datasets/Styles/style2/A young polar bear walks around his zoo exhibit.jpg,A young polar bear walks around his zoo exhibit
../../datasets/Styles/style2/The silly black fellow has a cell phone case strapped to his head with a rubber band.jpg,The silly black fellow has a cell phone case strapped to his head with a rubber band
../../datasets/Styles/style2/A women who is looking at various fruits at an outdoor vendor.jpg,A women who is looking at various fruits at an outdoor vendor
"../../datasets/Styles/style2/A model of a beach front scene showing the parking lot, beach and the sea.jpg","A model of a beach front scene showing the parking lot, beach and the sea"
../../datasets/Styles/style2/A man riding safety gear while atop a skateboard.jpg,A man riding safety gear while atop a skateboard
"../../datasets/Styles/style2/The living room has a couch, two easy chairs, and a television in it.jpg","The living room has a couch, two easy chairs, and a television in it"
../../datasets/Styles/style2/A toilet in a bathroom on an airplane.jpg,A toilet in a bathroom on an airplane
../../datasets/Styles/style2/A fruit and vegetable stand where produce is available for purchase.jpg,A fruit and vegetable stand where produce is available for purchase
../../datasets/Styles/style2/a large airplane that is parked on a runway.jpg,a large airplane that is parked on a runway
../../datasets/Styles/style2/A passenger bus that has pulled up to the curb of a street.jpg,A passenger bus that has pulled up to the curb of a street
../../datasets/Styles/style2/a airplane flying through the cloudy sky in daytime.jpg,a airplane flying through the cloudy sky in daytime
../../datasets/Styles/style2/a man in front of a bare background takes a bite of his sandwich.jpg,a man in front of a bare background takes a bite of his sandwich
../../datasets/Styles/style2/It seems here something is really amazing with many things to see.jpg,It seems here something is really amazing with many things to see
../../datasets/Styles/style2/A green colored bathroom with white toilets and bath tubs.jpg,A green colored bathroom with white toilets and bath tubs
../../datasets/Styles/style2/Furry pet cat lying lazily on rug using shoes as a head pillow.jpg,Furry pet cat lying lazily on rug using shoes as a head pillow
../../datasets/Styles/style2/This homemade pizza features plenty of cheese and onions.jpg,This homemade pizza features plenty of cheese and onions
../../datasets/Styles/style2/A elephant with grass on his back standing beside a building.jpg,A elephant with grass on his back standing beside a building
../../datasets/Styles/style2/A blender filled with food on top of a counter.jpg,A blender filled with food on top of a counter
../../datasets/Styles/style2/There is a puppy sitting on a toy car.jpg,There is a puppy sitting on a toy car
../../datasets/Styles/style2/A dog is standing on a chair at a computer desk.jpg,A dog is standing on a chair at a computer desk
../../datasets/Styles/style2/a computer and some paper on a desk.jpg,a computer and some paper on a desk
../../datasets/Styles/style2/A person standing on a  tennis court holding a racquet.jpg,A person standing on a  tennis court holding a racquet
../../datasets/Styles/style2/Two boats filled with bicycles near a river walk.jpg,Two boats filled with bicycles near a river walk
../../datasets/Styles/style2/a woman standing on top of a horse walking down the road.jpg,a woman standing on top of a horse walking down the road
../../datasets/Styles/style2/A man hitting a tennis ball with a racquet on a court.jpg,A man hitting a tennis ball with a racquet on a court
../../datasets/Styles/style2/A young man and woman talking next to a fire hydrant.jpg,A young man and woman talking next to a fire hydrant
../../datasets/Styles/style2/a number of small birds in cages.jpg,a number of small birds in cages
../../datasets/Styles/style2/A black and white post with a stop light on a corner.jpg,A black and white post with a stop light on a corner
../../datasets/Styles/style2/Large clock with green lights over the top of it.jpg,Large clock with green lights over the top of it
../../datasets/Styles/style2/A couch and a table in a room.jpg,A couch and a table in a room
../../datasets/Styles/style2/A colorful bird sitting on the end of a small branch.jpg,A colorful bird sitting on the end of a small branch
../../datasets/Styles/style2/A great tasting casserole cooking in the oven.jpg,A great tasting casserole cooking in the oven
../../datasets/Styles/style2/A large blue truck traveling through an urban area.jpg,A large blue truck traveling through an urban area
../../datasets/Styles/style2/A photo of the garden section of a store.jpg,A photo of the garden section of a store
../../datasets/Styles/style2/A man and a woman sit on different horses.jpg,A man and a woman sit on different horses
../../datasets/Styles/style2/Three people gathered around a table with a pizza in a box in it in an office environment.jpg,Three people gathered around a table with a pizza in a box in it in an office environment
../../datasets/Styles/style2/A boy in a baseball uniform has his hand back to pitch a ball as his other hand holds his baseball glove.jpg,A boy in a baseball uniform has his hand back to pitch a ball as his other hand holds his baseball glove
"../../datasets/Styles/style2/Two dogs, one sitting and one lying down, next to a bus.jpg","Two dogs, one sitting and one lying down, next to a bus"
../../datasets/Styles/style2/A woman by a sign preparing to go downhill skiing.jpg,A woman by a sign preparing to go downhill skiing
../../datasets/Styles/style2/A white plate with meat covered in gravy and vegetables.jpg,A white plate with meat covered in gravy and vegetables
../../datasets/Styles/style2/People sit underneath three blue umbrellas with bowls of fruit.jpg,People sit underneath three blue umbrellas with bowls of fruit
../../datasets/Styles/style2/there is a man riding a horse.jpg,there is a man riding a horse
../../datasets/Styles/style2/Ripe banana laying on top of container with fruit beside container of smoked almonds.jpg,Ripe banana laying on top of container with fruit beside container of smoked almonds
../../datasets/Styles/style2/Two people who are riding horses on a beach.jpg,Two people who are riding horses on a beach
../../datasets/Styles/style2/Pigeons sitting on a shingled roof in the city.jpg,Pigeons sitting on a shingled roof in the city
../../datasets/Styles/style2/Two women looking at their tennis racquets.jpg,Two women looking at their tennis racquets
../../datasets/Styles/style2/There is a full view of an outdoor area and it is nice.jpg,There is a full view of an outdoor area and it is nice
